{
  "source": "actify.fr",
  "scraped_at": "2026-02-02T14:24:19.717579",
  "count": 200,
  "listings": [
    {
      "url": "https://actify.fr/entreprises-liquidation-judiciaire/%f0%9f%8f%a1%e2%9c%a8-a-vendre-fonds-de-commerce-boulangerie-patisserie-%f0%9f%8d%9e%f0%9f%a5%90/",
      "titre": "🏡✨ À VENDRE : FONDS DE COMMERCE BOULANGERIE-PÂTISSERIE 🍞🥐",
      "date_limite_offres": "Date limite de dépôt des offres :\n03/03/2025",
      "date_limite_offres_iso": "2025-03-03",
      "statut": "Non en activité",
      "chiffre_affaires": "De 0 € à 250 000 €",
      "ca_min_eur": 0,
      "ca_max_eur": 250000,
      "salaries": "Entre 0 et 5",
      "sal_min": 0,
      "sal_max": 5,
      "anciennete": "Entre 2 et 5 ans",
      "deficit_reportable": "Non",
      "adresse": "LAPEYROUSE MORNAY , 26210",
      "code_postal": "26210",
      "departement": "26",
      "ville": "LAPEYROUSE MORNAY",
      "lieu": "LAPEYROUSE MORNAY",
      "description": "📍 Situé à Lapeyrouse-Mornay (Drôme)\n💰 Prix : 35 000 €\n🔹 Droit au bail : valable jusqu’au 21 novembre 2031 📜\n🔹 Loyer mensuel : 820 € ( hors droits, taxes et charges ) 💶\n🔹 Local de 4 a 15 ca 🏪\n✅ Comprend les actifs d'une boulangerie-pâtisserie ( voir liste fournie)\n📞 Intéressé(e) ? Contactez-moi pour plus d’infos ! 📩",
      "description_resume": "📍 Situé à Lapeyrouse-Mornay (Drôme)",
      "activite": "📍 Situé à Lapeyrouse-Mornay (Drôme)"
    },
    {
      "url": "https://actify.fr/entreprises-liquidation-judiciaire/%f0%9f%93%a3-appel-doffres-en-plan-de-cession-office-notarial%f0%9f%93%a3/",
      "titre": "📣 APPEL D'OFFRES – Office notarial📣",
      "date_limite_offres": "Date limite de dépôt des offres :\n24/11/2023",
      "date_limite_offres_iso": "2023-11-24",
      "chiffre_affaires": "De 2 500 001 € à 5 000 000 €",
      "ca_min_eur": 2500001,
      "ca_max_eur": 5000000,
      "salaries": "Entre 11 - 50",
      "sal_min": 11,
      "sal_max": 50,
      "anciennete": "Plus de 10 ans",
      "deficit_reportable": "Non",
      "code_naf": "6910Z",
      "adresse": "PARIS , 75000",
      "code_postal": "75000",
      "departement": "75",
      "ville": "PARIS",
      "lieu": "PARIS",
      "description": "Nous cherchons un repreneur pour un office notarial situé à Paris.\nL'étude qui emploie 20 salariés et a réalisé un chiffre d'affaires de 4,4M€ en 2022 a une activité principalement orientée vers l'immobilier professionnel et institutionnel.\nDLDO : Vendredi 24 novembre 2023 à 12h00\nLes demandes d'accès à la dataroom sont à adresser à :\n[email protected]",
      "description_resume": "Nous cherchons un repreneur pour un office notarial situé à Paris.",
      "activite": "Nous cherchons un repreneur pour un office notarial situé à Paris."
    },
    {
      "url": "https://actify.fr/entreprises-liquidation-judiciaire/1-08-recyclage/",
      "titre": "1.08 RECYCLAGE",
      "date_limite_offres": "Date limite de dépôt des offres :\n09/09/2025",
      "date_limite_offres_iso": "2025-09-09",
      "statut": "Non en activité",
      "chiffre_affaires": "Non renseigné",
      "salaries": "Non renseigné",
      "anciennete": "Entre 5 et 10 ans",
      "deficit_reportable": "Non",
      "adresse": "75 allée des Noisetiers\nBLYES , 01150",
      "code_postal": "01150",
      "departement": "01",
      "ville": "BLYES",
      "lieu": "BLYES",
      "description": "AVIS D'APPEL D'OFFRE diligenté dans le périmètre de l'article L642-19 du code de commerce dans le cadre de la procédure de liquidation judiciaire de SAS 1.08 RECYCLAGE. (Référence dossier : 24466)\nActivité : production de matières plastiques recyclées\nC.A. au 31/12/24 : 4.9M€\nActif immobilisé : 3M€\nDATE LIMITE DEPOT DES OFFRES :\nle 09-09-25 à 12 h\n(observation faite que ce délai fixé pour les besoins de la procédure pourrait ne pas être contraignant dans l’intérêt des créanciers).",
      "description_resume": "AVIS D'APPEL D'OFFRE diligenté dans le périmètre de l'article L642-19 du code de commerce dans le cadre de la procédure de liquidation judiciaire de SAS 1.08 RECYCLAGE. (Référence dossier : 24466)",
      "activite": "AVIS D'APPEL D'OFFRE diligenté dans le périmètre de l'article L642-19 du code de commerce dans le cadre de la procédure de liquidation judiciaire de SAS 1.08 RECYCLAGE. (Référence dossier : 24466)"
    },
    {
      "url": "https://actify.fr/entreprises-liquidation-judiciaire/1-immeuble-a-saint-pierre-doleron/",
      "titre": "1 immeuble à SAINT PIERRE D’OLERON",
      "date_limite_offres": "Date limite de dépôt des offres :\n31/01/2026",
      "date_limite_offres_iso": "2026-01-31",
      "chiffre_affaires": "Non renseigné",
      "salaries": "Non renseigné",
      "anciennete": "Entre 0 et 2 ans",
      "deficit_reportable": "Non",
      "adresse": "37, avenue de bel air\nSAINT-PIERRE-D'OLERON , 17310",
      "code_postal": "17310",
      "departement": "17",
      "ville": "SAINT-PIERRE-D'OLERON",
      "lieu": "SAINT-PIERRE-D'OLERON",
      "description": "IMMEUBLE CADASTRE SECTION BY 112, UNIQUEMENT LOTS 10 et 11\nDossier disponible sur le site www.ekip.eu\nOnglet actif - 46788\nLes offres devront impérativement être adressées auprès de la SELARL EKIP', prise en la personne de Maître Marie-Adéline ROUSSELOT-GÉGOUÉ, 9 rue Audry de Puyravault 17300 ROCHEFORT, impérativement avant le 1/10/2025 à 17h00.\n/! Les pièces du dossier ne seront accessibles qu'après communication par courriel de l'attestation de confidentialité dûment paraphée",
      "description_resume": "IMMEUBLE CADASTRE SECTION BY 112, UNIQUEMENT LOTS 10 et 11",
      "activite": "IMMEUBLE CADASTRE SECTION BY 112, UNIQUEMENT LOTS 10 et 11"
    },
    {
      "url": "https://actify.fr/entreprises-liquidation-judiciaire/1-immeuble/",
      "titre": "44596- Bâtiment à usage de dépôt à TONNAY CHARENTE 17430",
      "date_limite_offres": "Date limite de dépôt des offres :\n30/06/2024",
      "date_limite_offres_iso": "2024-06-30",
      "chiffre_affaires": "Non renseigné",
      "salaries": "Non renseigné",
      "anciennete": "Entre 0 et 2 ans",
      "deficit_reportable": "Non",
      "adresse": "152 bis, Avenue du Général de Gaulle\nTONNAY-CHARENTE , 17430",
      "code_postal": "17430",
      "departement": "17",
      "ville": "TONNAY-CHARENTE",
      "lieu": "TONNAY-CHARENTE",
      "description": "Bâtiment à usage de dépôt, cadastré section AO 194 d'une surface de 105 m² (préau : 34 m² et local 58 m²) sur une parcelle de 105 m²\nLes offres devront impérativement être adressées auprès de la SELARL EKIP', prise en la personne de Maître Marie-Adéline ROUSSELOT-GÉGOUÉ, 9, rue Audry de Puyravault 17300 ROCHEFORT, impérativement avant le 30/04/2024 à 17h00.\n/! Les pièces du dossier ne seront accessibles qu'après communication par courriel de l'attestation de confidentialité dûment paraphée, attestation librement téléchargeable sur le site www.ekip.eu, onglet “cession d’actif”, référence 44596",
      "description_resume": "Bâtiment à usage de dépôt, cadastré section AO 194 d'une surface de 105 m² (préau : 34 m² et local 58 m²) sur une parcelle de 105 m²",
      "surface_m2": "105",
      "activite": "Bâtiment à usage de dépôt, cadastré section AO 194 d'une surface de 105 m² (préau : 34 m² et local 58 m²) sur une parcelle de 105 m²"
    },
    {
      "url": "https://actify.fr/entreprises-liquidation-judiciaire/1-licence-3/",
      "titre": "1 licence 3",
      "date_limite_offres": "Date limite de dépôt des offres :\n15/05/2025",
      "date_limite_offres_iso": "2025-05-15",
      "chiffre_affaires": "Non renseigné",
      "salaries": "Non renseigné",
      "anciennete": "Entre 0 et 2 ans",
      "deficit_reportable": "Non",
      "adresse": "SAINT-PIERRE-D'OLERON , 17310",
      "code_postal": "17310",
      "departement": "17",
      "ville": "SAINT-PIERRE-D'OLERON",
      "lieu": "SAINT-PIERRE-D'OLERON",
      "description": "Dossier disponible sur le site www.ekip.eu\nOnglet actif - 47215\nLes offres devront impérativement être adressées auprès de la SELARL EKIP', prise en la personne de Maître Marie-Adéline ROUSSELOT-GÉGOUÉ, 9 rue Audry de Puyravault 17300 ROCHEFORT, impérativement avant le 30/04/2025 à 17h00.\n/! Les pièces du dossier ne seront accessibles qu'après communication par courriel de l'attestation de confidentialité dûment paraphée",
      "description_resume": "Dossier disponible sur le site www.ekip.eu",
      "activite": "Dossier disponible sur le site www.ekip.eu"
    },
    {
      "url": "https://actify.fr/entreprises-liquidation-judiciaire/1-societe-de-restauration-traditionnelle-2-fonds-de-commerce/",
      "titre": "1 Société de restauration traditionnelle / 2 Fonds de commerce",
      "date_limite_offres": "Date limite de dépôt des offres :\n03/03/2025",
      "date_limite_offres_iso": "2025-03-03",
      "statut": "Non en activité",
      "chiffre_affaires": "De 1 000 001 € à 2 500 000 €",
      "ca_min_eur": 1000001,
      "ca_max_eur": 2500000,
      "salaries": "Entre 11 - 50",
      "sal_min": 11,
      "sal_max": 50,
      "anciennete": "Entre 5 et 10 ans",
      "deficit_reportable": "Non",
      "code_naf": "5610A",
      "adresse": "MARSEILLE , 13002",
      "code_postal": "13002",
      "departement": "13",
      "ville": "MARSEILLE",
      "lieu": "MARSEILLE",
      "description": "Activité: Restauration traditionnelle: Établissements \"LA BULLE\" et \"LE ZUM-ZUM\".\nLocalisation: Région PACA\nEffectif: 15 salariés",
      "description_resume": "Activité: Restauration traditionnelle: Établissements \"LA BULLE\" et \"LE ZUM-ZUM\".",
      "activite": "Activité: Restauration traditionnelle: Établissements \"LA BULLE\" et \"LE ZUM-ZUM\".",
      "ca_historique": {
        "2023": "1094833"
      }
    },
    {
      "url": "https://actify.fr/entreprises-liquidation-judiciaire/10045-societe-specialisee-dans-les-travaux-de-platrerie/",
      "titre": "10045-Société spécialisée dans les travaux de plâtrerie",
      "date_limite_offres": "Date limite de dépôt des offres :\n15/12/2022",
      "date_limite_offres_iso": "2022-12-15",
      "chiffre_affaires": "De 2 500 001 € à 5 000 000 €",
      "ca_min_eur": 2500001,
      "ca_max_eur": 5000000,
      "salaries": "Entre 11 - 50",
      "sal_min": 11,
      "sal_max": 50,
      "anciennete": "Plus de 10 ans",
      "deficit_reportable": "Non",
      "adresse": "SAINT HILAIRE DE BRETHMAS , 30560",
      "code_postal": "30560",
      "departement": "30",
      "ville": "SAINT HILAIRE DE BRETHMAS",
      "lieu": "SAINT HILAIRE DE BRETHMAS",
      "description": "Société spécialisée dans les travaux de plâtrerie\n● Activité : Aménagements de lieux de vente, conseil et réalisation de faux plafonds, éclairage, rayonnages, chauffage, climatisation, cloisons, pose de menuiserie, parquets, isolation électrique.\n● Lieu : Saint-Hilaire-de-Brethmas (30)\n● Chiffre d’affaires :\n- au 31/12/2021 : 2 469 219 €\n- au 31/12/2020 : 2 862 457 €\n- au 31/12/2019 : 2 837 311 €\n● Effectif total : 16 salariés\nLa date limite de dépôt des offres de reprise sera fixée ultérieurement.\nL’accès à une data room électronique sera autorisé après régularisation d’un engagement de confidentialité et une présentation succincte du candidat. Réf. à rappeler 10045\nLes candidats intéressés sont invités à se manifester :\nSELARL FHB\nMaître Jean François BLANC, Administrateur Judiciaire Associé\n22 Rue des Chasseurs - 34070 Montpellier - www.fhbx.eu\ne-mails :\n[email protected]",
      "description_resume": "Société spécialisée dans les travaux de plâtrerie",
      "activite": "Société spécialisée dans les travaux de plâtrerie",
      "ca_historique": {
        "2021": "2469219",
        "2020": "2862457",
        "2019": "2837311"
      }
    },
    {
      "url": "https://actify.fr/entreprises-liquidation-judiciaire/10353-commerce-de-patisserie-et-restauration-rapide/",
      "titre": "10353 – Commerce de boulangerie-pâtisserie et restauration rapide",
      "date_limite_offres": "Date limite de dépôt des offres :\n27/03/2023",
      "date_limite_offres_iso": "2023-03-27",
      "chiffre_affaires": "De 250 001 € à 500 000 €",
      "ca_min_eur": 250001,
      "ca_max_eur": 500000,
      "salaries": "Entre 6 - 10",
      "sal_min": 6,
      "sal_max": 10,
      "anciennete": "Entre 2 et 5 ans",
      "deficit_reportable": "Non",
      "code_naf": "1071 C",
      "adresse": "MONTPELLIER , 34000",
      "code_postal": "34000",
      "departement": "34",
      "ville": "MONTPELLIER",
      "lieu": "MONTPELLIER",
      "description": "Recherche repreneur pour un commerce de boulangerie-pâtisserie et restauration rapide\nRedressement judiciaire du 26/09/2022\n• Activité : boulangerie, pâtisserie, restauration rapide, sandwicherie, snack\n• Lieu : Montpellier (34)\n• Chiffre d’affaires : au 30/09/2022 (9 mois) : 335 k€\nau 31/12/2021 (19 mois) : 647 k€\n• Effectif total : 7 salariés\nLa date limite de dépôt des offres de reprise est en cours de fixation.\nL’accès à une data room électronique sera autorisé après régularisation d’un engagement de\nconfidentialité et une présentation succincte du candidat.\nLes candidats intéressés sont invités à se manifester auprès de :\nSELARL FHB\nMe Jean-François BLANC\nAdministrateur\nJudiciaire Associé\n22 Rue des Chasseurs -\n34070 - Montpellier - www.fhbx.eu\ne-mail :\n[email protected]\nRéf : 10353",
      "description_resume": "Recherche repreneur pour un commerce de boulangerie-pâtisserie et restauration rapide",
      "activite": "Recherche repreneur pour un commerce de boulangerie-pâtisserie et restauration rapide"
    },
    {
      "url": "https://actify.fr/entreprises-liquidation-judiciaire/10407-societe-de-conception-production-et-vente-de-catamaran-haut-de-gamme-de-fabrication-francaise/",
      "titre": "10407 Société de conception, production et vente de catamaran haut de gamme de fabrication française",
      "date_limite_offres": "Date limite de dépôt des offres :\n24/02/2023",
      "date_limite_offres_iso": "2023-02-24",
      "statut": "Non en activité",
      "chiffre_affaires": "De 500 001 € à 1 000 000 €",
      "ca_min_eur": 500001,
      "ca_max_eur": 1000000,
      "salaries": "Entre 6 - 10",
      "sal_min": 6,
      "sal_max": 10,
      "anciennete": "Entre 0 et 2 ans",
      "deficit_reportable": "Non",
      "adresse": "PERPIGNAN , 66000",
      "code_postal": "66000",
      "departement": "66",
      "ville": "PERPIGNAN",
      "lieu": "PERPIGNAN",
      "description": "Société de conception, production et vente de catamaran haut de gamme de fabrication française\nRedressement judiciaire du 2 novembre 2022\n• Activité : Conception, fabrication, vente de bateaux de plaisance (catamaran)\n• Lieu : Pyrénées Orientales (66)\n• Chiffre d’affaires au 31/12/2022 (16 mois) : 566 k€\n• Effectif total : 7 salariés\nLa date limite de dépôt des offres de reprise est en cours de fixation.\nL’accès à une data room électronique sera autorisé après régularisation d’un engagement de\nconfidentialité et une présentation succincte du candidat.\nSELARL FHB\nMe Jean-François BLANC, Administrateur\nJudiciaire Associé\n22 Rue des Chasseurs -\n34070\nMontpellier - www.fhbx.eu\ne-mail :\n[email protected]\nRéf. 10407",
      "description_resume": "Société de conception, production et vente de catamaran haut de gamme de fabrication française",
      "activite": "Société de conception, production et vente de catamaran haut de gamme de fabrication française"
    },
    {
      "url": "https://actify.fr/entreprises-liquidation-judiciaire/10471-commerce-de-gros-dequipements-automobiles/",
      "titre": "10471 – Commerce de gros d’équipements automobiles.",
      "date_limite_offres": "Date limite de dépôt des offres :\n13/03/2023",
      "date_limite_offres_iso": "2023-03-13",
      "chiffre_affaires": "Plus de 10 000 000 €",
      "ca_min_eur": 10000000,
      "salaries": "Entre 51 - 100",
      "sal_min": 51,
      "sal_max": 100,
      "anciennete": "Plus de 10 ans",
      "deficit_reportable": "Non",
      "adresse": "MONTPELLIER , 34000",
      "code_postal": "34000",
      "departement": "34",
      "ville": "MONTPELLIER",
      "lieu": "MONTPELLIER",
      "description": "Commerce de gros d’équipements automobiles.\nRedressement judiciaire du 9 janvier 2023\nActivité : importation et distribution de pneumatiques, roues et chambres à air, spécialiste des pneus d’usage intensif (agraires, travaux publics, poids lourds, génie civil, manutention, véhicules de loisirs…).\n• Lieu : Siège social Hérault (34) – entrepôts/logistique Bouches-du-Rhône (13) et Indre-et-Loire (37)\n• Chiffre d’affaires :\nAu 31/12/2022 annoncé : 36 M€\nAu 31/12/2021 : 35 M€\nAu 31/12/2020 : 37 M€\n• Effectif total : 63 salariés\nLa date limite de dépôt des offres de reprise est en cours de fixation.\nL’accès à une data room électronique sera autorisé après régularisation d’un engagement de\nconfidentialité et une présentation succincte du candidat.\nSELARL FHB\nMe Jean-François BLANC\nAdministrateur Judiciaire Associé\n22 Rue des Chasseurs -\n34070 Montpellier - www.fhbx.eu\n04.67.42.19.20\ne-mail :\n[email protected]\nRéf : 10471",
      "description_resume": "Commerce de gros d’équipements automobiles.",
      "activite": "Commerce de gros d’équipements automobiles."
    },
    {
      "url": "https://actify.fr/entreprises-liquidation-judiciaire/10774-recherche-repreneur-ou-investisseur-pour-un-fonds-de-commerce-de-vente-et-pose-de-revetement-de-sol/",
      "titre": "10774 – Recherche repreneur ou investisseur pour un fonds de commerce de vente et pose de revêtement de sol",
      "date_limite_offres": "Date limite de dépôt des offres :\n05/05/2023",
      "date_limite_offres_iso": "2023-05-05",
      "statut": "Non en activité",
      "chiffre_affaires": "De 2 500 001 € à 5 000 000 €",
      "ca_min_eur": 2500001,
      "ca_max_eur": 5000000,
      "salaries": "Entre 11 - 50",
      "sal_min": 11,
      "sal_max": 50,
      "anciennete": "Plus de 10 ans",
      "deficit_reportable": "Non",
      "adresse": "Montpellier , 34000",
      "code_postal": "34000",
      "departement": "34",
      "ville": "Montpellier",
      "lieu": "Montpellier",
      "description": "Recherche repreneur ou investisseur pour un fonds de commerce de vente et pose de revêtement de sol\nFonds de commerce de vente et pose de revêtement de sol\nLiquidation judiciaire avec poursuite d’activité du 22 mars 2023\n• Activité :\n> Vente de revêtements de sol souples et durs, carrelages, faïences, chape fluide, béton ciré et imprimé, isolation, parquet,\n> Pose et rénovation de revêtements de sol et d’aménagement intérieur.\n• Lieu : Hérault (34)\n• Chiffre d’affaires : au 31/12/2022 : 2.985 k€\nau 31/12/2021 : 2.593 k€\n• Effectif total : 31 salariés\nLa date limite de dépôt des offres de reprise est fixée au vendredi 5 mai 2023 à 12h.\nL’accès à une data room électronique sera autorisé après régularisation d’un engagement de confidentialité et une présentation succincte du candidat.\nRéférence à rappeler : 10774\nLes candidats intéressés sont invités à se manifester auprès de :\nSELARL FHB\nMe Jean-François BLANC\nAdministrateur Judiciaire Associé\n22 Rue des Chasseurs -\n34070 - Montpellier\nwww.fhbx.eu\ne-mail :\n[email protected]\nRéf. : 10774",
      "description_resume": "Recherche repreneur ou investisseur pour un fonds de commerce de vente et pose de revêtement de sol",
      "activite": "Recherche repreneur ou investisseur pour un fonds de commerce de vente et pose de revêtement de sol",
      "ca_historique": {
        "2022": "2.985",
        "2021": "2.593"
      }
    },
    {
      "url": "https://actify.fr/entreprises-liquidation-judiciaire/108023-guisset-martine-creperie/",
      "titre": "108023 – GUISSET MARTINE – CREPERIE",
      "date_limite_offres": "Date limite de dépôt des offres :\n25/06/2022",
      "date_limite_offres_iso": "2022-06-25",
      "chiffre_affaires": "Non renseigné",
      "salaries": "Non renseigné",
      "anciennete": "Non renseignée",
      "deficit_reportable": "Non",
      "adresse": "11 avenue Bertherigues\nBARBENTANE , 13570",
      "code_postal": "13570",
      "departement": "13",
      "ville": "BARBENTANE",
      "lieu": "BARBENTANE",
      "description": "Madame Martine GUISSET exploitait, le 18 Juin 2004 un fonds de commerce situé 11 avenue Bertherigues - 13570 BARBENTANE, acquis pour le prix stipulé de 76.000 euros.\nPas de chiffre d'affaires à communiquer car la dirigeante était au régime micro-BIC professionnels",
      "description_resume": "Madame Martine GUISSET exploitait, le 18 Juin 2004 un fonds de commerce situé 11 avenue Bertherigues - 13570 BARBENTANE, acquis pour le prix stipulé de 76.000 euros.",
      "activite": "Madame Martine GUISSET exploitait, le 18 Juin 2004 un fonds de commerce situé 11 avenue Bertherigues - 13570 BARBENTANE, acquis pour le prix stipulé de 76.000 euros."
    },
    {
      "url": "https://actify.fr/entreprises-liquidation-judiciaire/10806-entreprise-de-boulangerie-patisserie-situee-dans-lherault/",
      "titre": "10806 – Entreprise de boulangerie-pâtisserie située dans l’Hérault",
      "date_limite_offres": "Date limite de dépôt des offres :\n11/09/2023",
      "date_limite_offres_iso": "2023-09-11",
      "chiffre_affaires": "De 500 001 € à 1 000 000 €",
      "ca_min_eur": 500001,
      "ca_max_eur": 1000000,
      "salaries": "Entre 11 - 50",
      "sal_min": 11,
      "sal_max": 50,
      "anciennete": "Entre 2 et 5 ans",
      "deficit_reportable": "Non",
      "code_naf": "10.71C",
      "adresse": "MONTPELLIER , 34000",
      "code_postal": "34000",
      "departement": "34",
      "ville": "MONTPELLIER",
      "lieu": "MONTPELLIER",
      "description": "Recherche repreneur pour une entreprise de boulangerie-pâtisserie située dans l’Hérault (34)\nRedressement judiciaire du 31/03/2023\n• Activité : Boulangerie, pâtisserie, viennoiserie traditionnelle, snacking sur place ou à emporter, achats revente de produits régionaux\n• Lieu : Hérault (34)\n• Chiffre d’affaires : au 30/06/2023 (projet 12 mois) : 914 k€\nau 30/06/2022 (12 mois) : 687 k€\nau 30/06/2021 (12 mois) : 688 k€\n• Effectif total : 17 salariés dont 1 CDD et 1 apprenti\nLa date limite de dépôt des offres de reprise est fixée au 11 septembre 2023 à 12 heures\nL’accès à une data room électronique sera autorisé après régularisation d’un engagement de confidentialité et une présentation succincte du candidat.\nLes candidats intéressés sont invités à se manifester auprès de :\nSELARL FHBX\nMe Jean-François BLANC\nAdministrateur\nJudiciaire Associé\n22 Rue des Chasseurs -\n34070\nMontpellier - www.fhbx.eu\ne-mail :\n[email protected]\nRéf : 10806",
      "description_resume": "Recherche repreneur pour une entreprise de boulangerie-pâtisserie située dans l’Hérault (34)",
      "activite": "Recherche repreneur pour une entreprise de boulangerie-pâtisserie située dans l’Hérault (34)"
    },
    {
      "url": "https://actify.fr/entreprises-liquidation-judiciaire/108105-sas-bdv-bio-biocoop-noves/",
      "titre": "108105 – SAS BDV BIO – BIOCOOP NOVES",
      "date_limite_offres": "Date limite de dépôt des offres :\n13/11/2022",
      "date_limite_offres_iso": "2022-11-13",
      "statut": "Non en activité",
      "chiffre_affaires": "De 500 001 € à 1 000 000 €",
      "ca_min_eur": 500001,
      "ca_max_eur": 1000000,
      "salaries": "Entre 0 et 5",
      "sal_min": 0,
      "sal_max": 5,
      "anciennete": "Entre 2 et 5 ans",
      "deficit_reportable": "Non",
      "adresse": "Zone de la Roque - 1 Chemin de la Roque\nNOVES , 13550",
      "code_postal": "13550",
      "departement": "13",
      "ville": "NOVES",
      "lieu": "NOVES",
      "description": "La SAS BDV BIO exploitait depuis le 03 mars 2020 un fonds de commerce de vente de tous produits alimentaires issus de l'agriculture biologique, compléments alimentaires, écoproduits, cosmétiques, livres, produits d'équipements de la maison et de la personne respectueux de l'environnement et de fournir toutes prestations de service y afférents, la vente de plats à emporter ainsi que l'organisation de services de restauration sur place. sis Zone de la Roque - 1 Chemin de la Roque - 13550 NOVES\nLoyer mensuel net de 3.600,00 Euros TTC",
      "description_resume": "La SAS BDV BIO exploitait depuis le 03 mars 2020 un fonds de commerce de vente de tous produits alimentaires issus de l'agriculture biologique, compléments alimentaires, écoproduits, cosmétiques, livr",
      "activite": "La SAS BDV BIO exploitait depuis le 03 mars 2020 un fonds de commerce de vente de tous produits alimentaires issus de l'agriculture biologique, compléments alimentaires, écoproduits, cosmétiques, livr"
    },
    {
      "url": "https://actify.fr/entreprises-liquidation-judiciaire/108109-rpm-dermatologie-fonds-de-commerce-de-recherche-en-cosmetique/",
      "titre": "108109 RPM DERMATOLOGIE FONDS DE COMMERCE DE RECHERCHE EN COSMETIQUE",
      "date_limite_offres": "Date limite de dépôt des offres :\n12/05/2023",
      "date_limite_offres_iso": "2023-05-12",
      "statut": "Non en activité",
      "chiffre_affaires": "De 0 € à 250 000 €",
      "ca_min_eur": 0,
      "ca_max_eur": 250000,
      "salaries": "Entre 0 et 5",
      "sal_min": 0,
      "sal_max": 5,
      "anciennete": "Entre 5 et 10 ans",
      "deficit_reportable": "Non",
      "code_naf": "7219Z",
      "adresse": "3 IMPASSE DE MERVELIN\nVILLENEUVE LES AVIGNON , 30400",
      "code_postal": "30400",
      "departement": "30",
      "ville": "VILLENEUVE LES AVIGNON",
      "lieu": "VILLENEUVE LES AVIGNON",
      "description": "Fonds de commerce de RECHERCHE ET DEVELOPPEMENT DANS LE DOMAINE SANTE ET COSMETIQUE, sis 3 Impasse du Mervelin 30400 VILLENEUVE LES AVIGNON comprenant :\nActifs corporels - Les instruments, matériels, outillages, livres, matériels informatiques et bureautiques et autres matériels de la société, - L’ensemble du stock de marchandises.\nActifs incorporels - L’enseigne et le nom commercial, - La propriété des marques déposées connues sous les dénominations « PEPTID7 » enregistrée le 06/03/2020 référencée FR4630377 et « MAEGE » enregistrée le 30/07/2015 référencée FR42200699, le fichier relatif à la clientèle et les noms de domaine et les droits d’auteur et droits d’exploitation des sites internet http://peptid7.com et http://maege-skincare.com - Les autorisations administratives et licences de toute nature, nécessaires à l’exploitation des éléments d’actifs présentement repris dont : o La License exclusive de brevet en cours avec le CNRS (C15087), les brevets de l'entreprise",
      "description_resume": "Fonds de commerce de RECHERCHE ET DEVELOPPEMENT DANS LE DOMAINE SANTE ET COSMETIQUE, sis 3 Impasse du Mervelin 30400 VILLENEUVE LES AVIGNON comprenant :",
      "activite": "Fonds de commerce de RECHERCHE ET DEVELOPPEMENT DANS LE DOMAINE SANTE ET COSMETIQUE, sis 3 Impasse du Mervelin 30400 VILLENEUVE LES AVIGNON comprenant :"
    },
    {
      "url": "https://actify.fr/entreprises-liquidation-judiciaire/108160-bar-le-cafe-de-france-sarl-les-2h-30300-beaucaire/",
      "titre": "108160 BAR LE CAFE DE FRANCE SARL LES 2H 30300 BEAUCAIRE",
      "date_limite_offres": "Date limite de dépôt des offres :\n31/01/2023",
      "date_limite_offres_iso": "2023-01-31",
      "statut": "Non en activité",
      "chiffre_affaires": "De 0 € à 250 000 €",
      "ca_min_eur": 0,
      "ca_max_eur": 250000,
      "salaries": "Entre 0 et 5",
      "sal_min": 0,
      "sal_max": 5,
      "anciennete": "Entre 5 et 10 ans",
      "deficit_reportable": "Non",
      "adresse": "1 PLACE GEORGES CLEMENCEAU\nBEAUCAIRE , 30300",
      "code_postal": "30300",
      "departement": "30",
      "ville": "BEAUCAIRE",
      "lieu": "BEAUCAIRE",
      "description": "L'EURL LES 2 H exploitait depuis le 01/05/2015, sous l'enseigne \"CAFE DE FRANCE\", un fonds de commerce de BAR - DEBIT DE BOISSONS, sis 1 Place Georges Clémenceau 30300 BEAUCAIRE, acquis auprès de Madame ROCHE Elisabeth (RCS NIMES 453 720) moyennant le prix de 97 500,00 Euros\nLoyer 1 075,77 Euros + TF 204 E + frais agence 15 E = 1 294,77 Euros/mois HT (pas de TVA)",
      "description_resume": "L'EURL LES 2 H exploitait depuis le 01/05/2015, sous l'enseigne \"CAFE DE FRANCE\", un fonds de commerce de BAR - DEBIT DE BOISSONS, sis 1 Place Georges Clémenceau 30300 BEAUCAIRE, acquis auprès de Mada",
      "activite": "L'EURL LES 2 H exploitait depuis le 01/05/2015, sous l'enseigne \"CAFE DE FRANCE\", un fonds de commerce de BAR - DEBIT DE BOISSONS, sis 1 Place Georges Clémenceau 30300 BEAUCAIRE, acquis auprès de Mada"
    },
    {
      "url": "https://actify.fr/entreprises-liquidation-judiciaire/108168-carrement-pain-boulangerie-127-route-dales-30000-nimes/",
      "titre": "108168 CARREMENT PAIN BOULANGERIE 127 ROUTE D'ALES 30000 NIMES",
      "date_limite_offres": "Date limite de dépôt des offres :\n30/06/2023",
      "date_limite_offres_iso": "2023-06-30",
      "statut": "Non en activité",
      "chiffre_affaires": "De 250 001 € à 500 000 €",
      "ca_min_eur": 250001,
      "ca_max_eur": 500000,
      "salaries": "Entre 0 et 5",
      "sal_min": 0,
      "sal_max": 5,
      "anciennete": "Entre 2 et 5 ans",
      "deficit_reportable": "Non",
      "adresse": "127 ROUTE D'ALES\nNIMES , 30000",
      "code_postal": "30000",
      "departement": "30",
      "ville": "NIMES",
      "lieu": "NIMES",
      "description": "FONDS DE COMMERCE DE BOULANGERIE PATISSERIE VIENNOISERIES SITUE A NIMES 127 ROUTE D'ALES\nACQUIS EN AVRIL 2019 POUR 235.000 EUROS\nMIS EN VENTE PAR LE DIRIGEANT A 150 000 EUROS\n3 SALARIES\nBILAN MARS 2023\nBAIL RENOUVELE EN 2018 – LOYER 1 544,60 EUROS/MOIS\n1 CONTRAT DE LOCATION LOCAM POUR LA CAISSE ENREGISTREUSE\n1 CONTRAT DE LOCATION SIEMENS LEASE POUR LA DIVISEUS\nDATE LIMITE DE DEPOT DES OFFRES : 30/06/2023",
      "description_resume": "FONDS DE COMMERCE DE BOULANGERIE PATISSERIE VIENNOISERIES SITUE A NIMES 127 ROUTE D'ALES",
      "activite": "FONDS DE COMMERCE DE BOULANGERIE PATISSERIE VIENNOISERIES SITUE A NIMES 127 ROUTE D'ALES"
    },
    {
      "url": "https://actify.fr/entreprises-liquidation-judiciaire/108195-garin-sarl-boulangerie-la-mordoree-30210-valliguieres/",
      "titre": "108195 GARIN SARL – BOULANGERIE LA MORDOREE 30210 VALLIGUIERES",
      "date_limite_offres": "Date limite de dépôt des offres :\n15/02/2023",
      "date_limite_offres_iso": "2023-02-15",
      "statut": "Non en activité",
      "chiffre_affaires": "De 250 001 € à 500 000 €",
      "ca_min_eur": 250001,
      "ca_max_eur": 500000,
      "salaries": "Entre 0 et 5",
      "sal_min": 0,
      "sal_max": 5,
      "anciennete": "Entre 0 et 2 ans",
      "deficit_reportable": "Non",
      "adresse": "4 AVENUE MISTRAL\nVALLIGUIERES , 30210",
      "code_postal": "30210",
      "departement": "30",
      "ville": "VALLIGUIERES",
      "lieu": "VALLIGUIERES",
      "description": "A compter du 01/03/2020, la SARL GARIN exploitait également un fonds de commerce situé 4 Avenue du Mistral 30210 VALLIGUIERES, sous l'enseigne \"LA MORDOREE\", acquis de la société LA MORDOREE moyennant le prix de 95 000 Euros.\nBail commercial pour local commercial et logement de 1 495 Euros par mois.\ncontrat de sous location du logement de fonction moyennant un loyer de 550 Euros mensuel (contrat du 01/03/2020 – durée 3 ans)",
      "description_resume": "A compter du 01/03/2020, la SARL GARIN exploitait également un fonds de commerce situé 4 Avenue du Mistral 30210 VALLIGUIERES, sous l'enseigne \"LA MORDOREE\", acquis de la société LA MORDOREE moyennant",
      "activite": "A compter du 01/03/2020, la SARL GARIN exploitait également un fonds de commerce situé 4 Avenue du Mistral 30210 VALLIGUIERES, sous l'enseigne \"LA MORDOREE\", acquis de la société LA MORDOREE moyennant"
    },
    {
      "url": "https://actify.fr/entreprises-liquidation-judiciaire/108195-garin-sarl-boulangerie-le-comptoir-du-lion-30300-comps/",
      "titre": "108195 GARIN SARL – BOULANGERIE LE COMPTOIR DU LION 30300 COMPS",
      "date_limite_offres": "Date limite de dépôt des offres :\n15/02/2023",
      "date_limite_offres_iso": "2023-02-15",
      "statut": "Non en activité",
      "chiffre_affaires": "De 250 001 € à 500 000 €",
      "ca_min_eur": 250001,
      "ca_max_eur": 500000,
      "salaries": "Entre 0 et 5",
      "sal_min": 0,
      "sal_max": 5,
      "anciennete": "Entre 2 et 5 ans",
      "deficit_reportable": "Non",
      "adresse": "22 IMPASSE SADI CARNOT\nCOMPS , 30300",
      "code_postal": "30300",
      "departement": "30",
      "ville": "COMPS",
      "lieu": "COMPS",
      "description": "La SARL GARIN exploitait depuis le 01/03/2017, sous l'enseigne COMPTOIR DU LION, un fonds de commerce de BOULANGERIE, BOULANGERIE-PATISSERIE, VIENNOISERIE, CHOCOLATERIE, GLACIER, SALON DE THE, CONFISERIE, SALADERIE, TRAITEUR, EPICERIE FINE, CONSOMMATION SUR PLACE ET A EMPORTER VENTE DE BOISSONS, VENTE DE BOISSONS ALCOLISEES UNIQUEMENT A EMPORTER, sis 22 Impasse Sadi Carnot 30300 COMPS, acquis de Monsieur LARHER Gaël moyennant le prix de 50 000 Euros.\nLoyer mensuel de 500 euros.",
      "description_resume": "La SARL GARIN exploitait depuis le 01/03/2017, sous l'enseigne COMPTOIR DU LION, un fonds de commerce de BOULANGERIE, BOULANGERIE-PATISSERIE, VIENNOISERIE, CHOCOLATERIE, GLACIER, SALON DE THE, CONFISE",
      "activite": "La SARL GARIN exploitait depuis le 01/03/2017, sous l'enseigne COMPTOIR DU LION, un fonds de commerce de BOULANGERIE, BOULANGERIE-PATISSERIE, VIENNOISERIE, CHOCOLATERIE, GLACIER, SALON DE THE, CONFISE"
    },
    {
      "url": "https://actify.fr/entreprises-liquidation-judiciaire/108248-sarl-auguste-et-fils-boulangerie-patisserie-noves/",
      "titre": "108248 – SARL AUGUSTE ET FILS  – BOULANGERIE PATISSERIE NOVES",
      "date_limite_offres": "Date limite de dépôt des offres :\n15/03/2023",
      "date_limite_offres_iso": "2023-03-15",
      "statut": "Non en activité",
      "chiffre_affaires": "De 0 € à 250 000 €",
      "ca_min_eur": 0,
      "ca_max_eur": 250000,
      "salaries": "Non renseigné",
      "anciennete": "Plus de 10 ans",
      "deficit_reportable": "Non",
      "code_naf": "1071C",
      "adresse": "6 avenue de la Première Armée\nNOVES , 13550",
      "code_postal": "13550",
      "departement": "13",
      "ville": "NOVES",
      "lieu": "NOVES",
      "description": "La SARL BOULANGERIE PATISSERIE AUGUSTE ET FILS exploite, depuis le 01/11/1989, un fonds de commerce de BOULANGERIE-PATISSERIE sis 6 avenue de la Première Armée - 13550 NOVES\nChiffres d'affaires :\n2022 : 172.067 Euros,\n2021 : 193.411 Euros,",
      "description_resume": "La SARL BOULANGERIE PATISSERIE AUGUSTE ET FILS exploite, depuis le 01/11/1989, un fonds de commerce de BOULANGERIE-PATISSERIE sis 6 avenue de la Première Armée - 13550 NOVES",
      "activite": "La SARL BOULANGERIE PATISSERIE AUGUSTE ET FILS exploite, depuis le 01/11/1989, un fonds de commerce de BOULANGERIE-PATISSERIE sis 6 avenue de la Première Armée - 13550 NOVES"
    },
    {
      "url": "https://actify.fr/entreprises-liquidation-judiciaire/108268-cpvb-au-dela-du-regard-fonds-opticien-a-vendre/",
      "titre": "108268 CPVB AU DELA DU REGARD – FONDS OPTICIEN A VENDRE",
      "date_limite_offres": "Date limite de dépôt des offres :\n31/05/2023",
      "date_limite_offres_iso": "2023-05-31",
      "statut": "Non en activité",
      "chiffre_affaires": "De 0 € à 250 000 €",
      "ca_min_eur": 0,
      "ca_max_eur": 250000,
      "salaries": "Entre 0 et 5",
      "sal_min": 0,
      "sal_max": 5,
      "anciennete": "Plus de 10 ans",
      "deficit_reportable": "Non",
      "code_naf": "4778A",
      "adresse": "70 RUE DES GOELANDS MAS GARDIES\nNIMES , 30900",
      "code_postal": "30900",
      "departement": "30",
      "ville": "NIMES",
      "lieu": "NIMES",
      "description": "Fonds de commerce de TRANSFORMATION, REPARATION, VENTE ARTICLES ET APPAREILS D'OPTIQUES, LUNETTERIE, LENTILLES DE CONTACT, ACOUSTIQUE MEDICALE ET PHOTOGRAPHIE, sis Rue des Goélands, Mas des Gardies 30900 NIMES, exploité sous l’enseigne AU DELA DU REGARD.\nLOYER MENSUEL DE 1 218,63 € HT soit 1 584,18 € TTC avec charges et provision foncier",
      "description_resume": "Fonds de commerce de TRANSFORMATION, REPARATION, VENTE ARTICLES ET APPAREILS D'OPTIQUES, LUNETTERIE, LENTILLES DE CONTACT, ACOUSTIQUE MEDICALE ET PHOTOGRAPHIE, sis Rue des Goélands, Mas des Gardies 30",
      "activite": "Fonds de commerce de TRANSFORMATION, REPARATION, VENTE ARTICLES ET APPAREILS D'OPTIQUES, LUNETTERIE, LENTILLES DE CONTACT, ACOUSTIQUE MEDICALE ET PHOTOGRAPHIE, sis Rue des Goélands, Mas des Gardies 30"
    },
    {
      "url": "https://actify.fr/entreprises-liquidation-judiciaire/108281-flomarisse-fonds-de-commerce-de-boulangerie-sis-a-chateaurenard/",
      "titre": "108281 – FLOMARISSE – FONDS DE COMMERCE DE BOULANGERIE SIS A CHATEAURENARD",
      "date_limite_offres": "Date limite de dépôt des offres :\n09/05/2023",
      "date_limite_offres_iso": "2023-05-09",
      "statut": "Non en activité",
      "chiffre_affaires": "De 0 € à 250 000 €",
      "ca_min_eur": 0,
      "ca_max_eur": 250000,
      "salaries": "Non renseigné",
      "anciennete": "Entre 5 et 10 ans",
      "deficit_reportable": "Non",
      "adresse": "60 Cours Carnot\nCHATEAURENARD , 13160",
      "code_postal": "13160",
      "departement": "13",
      "ville": "CHATEAURENARD",
      "lieu": "CHATEAURENARD",
      "description": "La SAS FLOMARISSE exploitait, sous l'enseigne AU CROUSTY CASTEL, depuis le 1er avril 2017, un fonds de commerce de Boulangerie pâtisserie viennoiserie chocolaterie glacier confiserie saladerie traiteur salon de thé venté de boissons non alcoolisées consommation sur place et à emporter sis 60 Cours Carnot - 13160 CHATEAURENARD.\nLoyer mensuel net : 822,00 Euros",
      "description_resume": "La SAS FLOMARISSE exploitait, sous l'enseigne AU CROUSTY CASTEL, depuis le 1er avril 2017, un fonds de commerce de Boulangerie pâtisserie viennoiserie chocolaterie glacier confiserie saladerie traiteu",
      "activite": "La SAS FLOMARISSE exploitait, sous l'enseigne AU CROUSTY CASTEL, depuis le 1er avril 2017, un fonds de commerce de Boulangerie pâtisserie viennoiserie chocolaterie glacier confiserie saladerie traiteu"
    },
    {
      "url": "https://actify.fr/entreprises-liquidation-judiciaire/108294-patisserie-chocolatier-jouval-145-rue-condamine-30600-vauvert/",
      "titre": "108294 PATISSERIE CHOCOLATIER JOUVAL 145 RUE CONDAMINE 30600 VAUVERT",
      "date_limite_offres": "Date limite de dépôt des offres :\n30/06/2023",
      "date_limite_offres_iso": "2023-06-30",
      "statut": "Non en activité",
      "chiffre_affaires": "De 250 001 € à 500 000 €",
      "ca_min_eur": 250001,
      "ca_max_eur": 500000,
      "salaries": "Entre 0 et 5",
      "sal_min": 0,
      "sal_max": 5,
      "anciennete": "Entre 5 et 10 ans",
      "deficit_reportable": "Non",
      "adresse": "145 RUE DE LA CONDAMINE\nVAUVERT , 30600",
      "code_postal": "30600",
      "departement": "30",
      "ville": "VAUVERT",
      "lieu": "VAUVERT",
      "description": "Fonds de commerce de PATISSERIE, BOULANGERIE, CHOCOLATERIE, CONFISERIE, GLACIER, SALON DE THE ET TOUTES ACTIVITES LIEES, sis 145 Avenue de la Condamine 30600 VAUVERT, acquis le 27/09/2013 de Monsieur JOUVAL Robert, moyennant le prix de 150.000,00 Euros\nBAIL COMMERCIAL LOYER MENSUEL DE 2 023,86 EUROS\nCA HT 31/12/2021 : 345.928,00 EUROS",
      "description_resume": "Fonds de commerce de PATISSERIE, BOULANGERIE, CHOCOLATERIE, CONFISERIE, GLACIER, SALON DE THE ET TOUTES ACTIVITES LIEES, sis 145 Avenue de la Condamine 30600 VAUVERT, acquis le 27/09/2013 de Monsieur ",
      "activite": "Fonds de commerce de PATISSERIE, BOULANGERIE, CHOCOLATERIE, CONFISERIE, GLACIER, SALON DE THE ET TOUTES ACTIVITES LIEES, sis 145 Avenue de la Condamine 30600 VAUVERT, acquis le 27/09/2013 de Monsieur "
    },
    {
      "url": "https://actify.fr/entreprises-liquidation-judiciaire/108296-boulangerie-jouval-31-rue-republique-30000-nimes/",
      "titre": "108296 BOULANGERIE JOUVAL – 31 RUE REPUBLIQUE 30000 NIMES",
      "date_limite_offres": "Date limite de dépôt des offres :\n30/06/2023",
      "date_limite_offres_iso": "2023-06-30",
      "statut": "Non en activité",
      "chiffre_affaires": "De 250 001 € à 500 000 €",
      "ca_min_eur": 250001,
      "ca_max_eur": 500000,
      "salaries": "Entre 0 et 5",
      "sal_min": 0,
      "sal_max": 5,
      "anciennete": "Entre 0 et 2 ans",
      "deficit_reportable": "Non",
      "adresse": "31 rue de la République\nNIMES , 30000",
      "code_postal": "30000",
      "departement": "30",
      "ville": "NIMES",
      "lieu": "NIMES",
      "description": "Fonds de commerce de BOULANGERIE ET PATISSERIE, sis 31 Rue de la République 30900 NIMES, acquis le 15/08/2020 de Madame ROUQUETTE Solange moyennant le prix de 160 000 Euros;\nLOYER TRIMESTRIEL DE 3 156,54 EUROS (1 045,52 EUROS PAR MOIS)\nCA 31/12/2021 : 389 590,00 EUROS HT",
      "description_resume": "Fonds de commerce de BOULANGERIE ET PATISSERIE, sis 31 Rue de la République 30900 NIMES, acquis le 15/08/2020 de Madame ROUQUETTE Solange moyennant le prix de 160 000 Euros;",
      "activite": "Fonds de commerce de BOULANGERIE ET PATISSERIE, sis 31 Rue de la République 30900 NIMES, acquis le 15/08/2020 de Madame ROUQUETTE Solange moyennant le prix de 160 000 Euros;"
    },
    {
      "url": "https://actify.fr/entreprises-liquidation-judiciaire/108300-carrelages-du-midi-415-av-docteur-fleming-zi-saint-cesaire-nimes/",
      "titre": "108300 CARRELAGES DU MIDI 415 AV DOCTEUR FLEMING ZI SAINT CESAIRE NIMES",
      "date_limite_offres": "Date limite de dépôt des offres :\n30/06/2023",
      "date_limite_offres_iso": "2023-06-30",
      "statut": "Non en activité",
      "chiffre_affaires": "De 250 001 € à 500 000 €",
      "ca_min_eur": 250001,
      "ca_max_eur": 500000,
      "salaries": "Entre 0 et 5",
      "sal_min": 0,
      "sal_max": 5,
      "anciennete": "Plus de 10 ans",
      "deficit_reportable": "Non",
      "adresse": "415 AVENUE DU DOCTEUR FLEMING ZI SAINT CESAIRE\nNIMES , 30900",
      "code_postal": "30900",
      "departement": "30",
      "ville": "NIMES",
      "lieu": "NIMES",
      "description": "Fonds de commerce de VENTE, COMMERCE DE GROS ET DE DETAIL DE CARRELAGE, sis 415 Avenue Docteur\nFlemming, ZI Saint Césaire 30000 NIMES.\nBAIL COMMERCIAL - LOYER MENSUEL DE 2 214,14 EUROS\n2 SALARIES\nSTOCK ESTIME PAR LE DIRIGEANT A 81 000 EUROS (PRIX ACHAT HT) - ACTIF CORPOREL ESTIME A 25 000\nEUROS PAR LE DIRIGEANT DONT 10 000 EUROS DE RAYONNAGES NEUFS ET 1 FENWICK - INVENTAIRE EN\nCOURS",
      "description_resume": "Fonds de commerce de VENTE, COMMERCE DE GROS ET DE DETAIL DE CARRELAGE, sis 415 Avenue Docteur",
      "activite": "Fonds de commerce de VENTE, COMMERCE DE GROS ET DE DETAIL DE CARRELAGE, sis 415 Avenue Docteur"
    },
    {
      "url": "https://actify.fr/entreprises-liquidation-judiciaire/108328-bio-uzes-enseigne-la-vie-claire-vente-produits-bio/",
      "titre": "108328 BIO UZES ENSEIGNE LA VIE CLAIRE VENTE PRODUITS BIO",
      "date_limite_offres": "Date limite de dépôt des offres :\n15/08/2023",
      "date_limite_offres_iso": "2023-08-15",
      "statut": "Non en activité",
      "chiffre_affaires": "De 0 € à 250 000 €",
      "ca_min_eur": 0,
      "ca_max_eur": 250000,
      "salaries": "Entre 0 et 5",
      "sal_min": 0,
      "sal_max": 5,
      "anciennete": "Entre 2 et 5 ans",
      "deficit_reportable": "Non",
      "code_naf": "7010Z",
      "adresse": "1200 route de Remoulins ZI pont des charrettes\nUZES , 30700",
      "code_postal": "30700",
      "departement": "30",
      "ville": "UZES",
      "lieu": "UZES",
      "description": "Fonds de commerce de COMMERCIALISATION DE PRODUITS ALIMENTAIRES situé ZONE INDUSTRIELLE PONT DES CHARETTES, BATIMENT 1 LOT 2, 30700 UZES, exploité sous l’enseigne « LA VIE CLAIRE »,\nLoyer mensuel de 4 526,65 Euros TTC incluant la provision pour charges\nMagasin d'une surface d''environ 296 m2\n3 salariés dont 1 CDI à temps partiel 20h, 1 apprenti fin de contrat 31/07/2023, 1 apprenti fin de contrat Septembre 2024",
      "description_resume": "Fonds de commerce de COMMERCIALISATION DE PRODUITS ALIMENTAIRES situé ZONE INDUSTRIELLE PONT DES CHARETTES, BATIMENT 1 LOT 2, 30700 UZES, exploité sous l’enseigne « LA VIE CLAIRE »,",
      "surface_m2": "296",
      "activite": "Fonds de commerce de COMMERCIALISATION DE PRODUITS ALIMENTAIRES situé ZONE INDUSTRIELLE PONT DES CHARETTES, BATIMENT 1 LOT 2, 30700 UZES, exploité sous l’enseigne « LA VIE CLAIRE »,"
    },
    {
      "url": "https://actify.fr/entreprises-liquidation-judiciaire/108934-delices-sanilhacois-boulangerie-patisserie-30700-sanilhac-2/",
      "titre": "108934 DELICES SANILHACOIS BOULANGERIE PATISSERIE – 30700 SANILHAC",
      "date_limite_offres": "Date limite de dépôt des offres :\n20/06/2025",
      "date_limite_offres_iso": "2025-06-20",
      "statut": "Non en activité",
      "chiffre_affaires": "De 250 001 € à 500 000 €",
      "ca_min_eur": 250001,
      "ca_max_eur": 500000,
      "salaries": "Entre 0 et 5",
      "sal_min": 0,
      "sal_max": 5,
      "anciennete": "Entre 2 et 5 ans",
      "deficit_reportable": "Non",
      "adresse": "1 ROUTE DE NIMES\nSANILHAC SAGRIES , 30700",
      "code_postal": "30700",
      "departement": "30",
      "ville": "SANILHAC SAGRIES",
      "lieu": "SANILHAC SAGRIES",
      "description": "FONDS DE COMMERCE DE BOULANGERIE PATISSERIE VIENNOISERIES SALON DE THE ET LOCATION DE VELOS SITUE 1 ROUTE DE NIMES 30700 SANILHAC-SAGRIES, ACQUIS EN AVRIL 2020 MOYENNANT LE PRIX DE 240 000 EUROS\nCA 2024 : 309 651 €\n2 SALARIES\nLOYER MENSUEL : 1 135 € + TAXE FONCIERE A REMBOURSER AU BAILLEUR (1 580,65 Euros en 2024)\nINVENTAIRE DE L'ACTIF CORPOREL EN COURS\nLOCAL DE 300 M2 EN TOTALITE AVEC SOUS LOCATION SUR 40M2 A LA SOCIETE TINKIETE (PRODUCTEUR DE LIQUEUR DE THYM) POUR 300 EUROS PAR MOIS\nSOUS LOCATION VERSEE DIRECTEMENT AU BAILLEUR - LOYER NET MENSUEL RAMENE A 835 EUROS\nDEPOT DE GARANTIE : 2 080 EUROS",
      "description_resume": "FONDS DE COMMERCE DE BOULANGERIE PATISSERIE VIENNOISERIES SALON DE THE ET LOCATION DE VELOS SITUE 1 ROUTE DE NIMES 30700 SANILHAC-SAGRIES, ACQUIS EN AVRIL 2020 MOYENNANT LE PRIX DE 240 000 EUROS",
      "activite": "FONDS DE COMMERCE DE BOULANGERIE PATISSERIE VIENNOISERIES SALON DE THE ET LOCATION DE VELOS SITUE 1 ROUTE DE NIMES 30700 SANILHAC-SAGRIES, ACQUIS EN AVRIL 2020 MOYENNANT LE PRIX DE 240 000 EUROS",
      "ca_historique": {
        "2024": "309651"
      }
    },
    {
      "url": "https://actify.fr/entreprises-liquidation-judiciaire/108934-delices-sanilhacois-boulangerie-patisserie-30700-sanilhac-3/",
      "titre": "108934 DELICES SANILHACOIS BOULANGERIE PATISSERIE – 30700 SANILHAC",
      "date_limite_offres": "Date limite de dépôt des offres :\n20/06/2025",
      "date_limite_offres_iso": "2025-06-20",
      "statut": "Non en activité",
      "chiffre_affaires": "De 250 001 € à 500 000 €",
      "ca_min_eur": 250001,
      "ca_max_eur": 500000,
      "salaries": "Entre 0 et 5",
      "sal_min": 0,
      "sal_max": 5,
      "anciennete": "Entre 2 et 5 ans",
      "deficit_reportable": "Non",
      "adresse": "1 ROUTE DE NIMES\nSANILHAC SAGRIES , 30700",
      "code_postal": "30700",
      "departement": "30",
      "ville": "SANILHAC SAGRIES",
      "lieu": "SANILHAC SAGRIES",
      "description": "FONDS DE COMMERCE DE BOULANGERIE PATISSERIE VIENNOISERIES SALON DE THE ET LOCATION DE VELOS SITUE 1 ROUTE DE NIMES 30700 SANILHAC-SAGRIES, ACQUIS EN AVRIL 2020 MOYENNANT LE PRIX DE 240 000 EUROS\nCA 2024 : 309 651 €\n2 SALARIES\nLOYER MENSUEL : 1 135 € + TAXE FONCIERE A REMBOURSER AU BAILLEUR (1 580,65 Euros en 2024)\nINVENTAIRE DE L'ACTIF CORPOREL EN COURS\nLOCAL DE 300 M2 EN TOTALITE AVEC SOUS LOCATION SUR 40M2 A LA SOCIETE TINKIETE (PRODUCTEUR DE LIQUEUR DE THYM) POUR 300 EUROS PAR MOIS\nSOUS LOCATION VERSEE DIRECTEMENT AU BAILLEUR - LOYER NET MENSUEL RAMENE A 835 EUROS\nDEPOT DE GARANTIE : 2 080 EUROS",
      "description_resume": "FONDS DE COMMERCE DE BOULANGERIE PATISSERIE VIENNOISERIES SALON DE THE ET LOCATION DE VELOS SITUE 1 ROUTE DE NIMES 30700 SANILHAC-SAGRIES, ACQUIS EN AVRIL 2020 MOYENNANT LE PRIX DE 240 000 EUROS",
      "activite": "FONDS DE COMMERCE DE BOULANGERIE PATISSERIE VIENNOISERIES SALON DE THE ET LOCATION DE VELOS SITUE 1 ROUTE DE NIMES 30700 SANILHAC-SAGRIES, ACQUIS EN AVRIL 2020 MOYENNANT LE PRIX DE 240 000 EUROS",
      "ca_historique": {
        "2024": "309651"
      }
    },
    {
      "url": "https://actify.fr/entreprises-liquidation-judiciaire/108934-delices-sanilhacois-boulangerie-patisserie-30700-sanilhac-4/",
      "titre": "108934 DELICES SANILHACOIS BOULANGERIE PATISSERIE – 30700 SANILHAC",
      "date_limite_offres": "Date limite de dépôt des offres :\n20/06/2025",
      "date_limite_offres_iso": "2025-06-20",
      "statut": "Non en activité",
      "chiffre_affaires": "De 250 001 € à 500 000 €",
      "ca_min_eur": 250001,
      "ca_max_eur": 500000,
      "salaries": "Entre 0 et 5",
      "sal_min": 0,
      "sal_max": 5,
      "anciennete": "Entre 2 et 5 ans",
      "deficit_reportable": "Non",
      "adresse": "1 ROUTE DE NIMES\nSANILHAC SAGRIES , 30700",
      "code_postal": "30700",
      "departement": "30",
      "ville": "SANILHAC SAGRIES",
      "lieu": "SANILHAC SAGRIES",
      "description": "FONDS DE COMMERCE DE BOULANGERIE PATISSERIE VIENNOISERIES SALON DE THE ET LOCATION DE VELOS SITUE 1 ROUTE DE NIMES 30700 SANILHAC-SAGRIES, ACQUIS EN AVRIL 2020 MOYENNANT LE PRIX DE 240 000 EUROS\nCA 2024 : 309 651 €\n2 SALARIES\nLOYER MENSUEL : 1 135 € + TAXE FONCIERE A REMBOURSER AU BAILLEUR (1 580,65 Euros en 2024)\nINVENTAIRE DE L'ACTIF CORPOREL EN COURS\nLOCAL DE 300 M2 EN TOTALITE AVEC SOUS LOCATION SUR 40M2 A LA SOCIETE TINKIETE (PRODUCTEUR DE LIQUEUR DE THYM) POUR 300 EUROS PAR MOIS\nSOUS LOCATION VERSEE DIRECTEMENT AU BAILLEUR - LOYER NET MENSUEL RAMENE A 835 EUROS\nDEPOT DE GARANTIE : 2 080 EUROS",
      "description_resume": "FONDS DE COMMERCE DE BOULANGERIE PATISSERIE VIENNOISERIES SALON DE THE ET LOCATION DE VELOS SITUE 1 ROUTE DE NIMES 30700 SANILHAC-SAGRIES, ACQUIS EN AVRIL 2020 MOYENNANT LE PRIX DE 240 000 EUROS",
      "activite": "FONDS DE COMMERCE DE BOULANGERIE PATISSERIE VIENNOISERIES SALON DE THE ET LOCATION DE VELOS SITUE 1 ROUTE DE NIMES 30700 SANILHAC-SAGRIES, ACQUIS EN AVRIL 2020 MOYENNANT LE PRIX DE 240 000 EUROS",
      "ca_historique": {
        "2024": "309651"
      }
    },
    {
      "url": "https://actify.fr/entreprises-liquidation-judiciaire/108934-delices-sanilhacois-boulangerie-patisserie-30700-sanilhac/",
      "titre": "108934 DELICES SANILHACOIS BOULANGERIE PATISSERIE – 30700 SANILHAC",
      "date_limite_offres": "Date limite de dépôt des offres :\n20/06/2025",
      "date_limite_offres_iso": "2025-06-20",
      "statut": "Non en activité",
      "chiffre_affaires": "De 250 001 € à 500 000 €",
      "ca_min_eur": 250001,
      "ca_max_eur": 500000,
      "salaries": "Entre 0 et 5",
      "sal_min": 0,
      "sal_max": 5,
      "anciennete": "Entre 2 et 5 ans",
      "deficit_reportable": "Non",
      "adresse": "1 ROUTE DE NIMES\nSANILHAC SAGRIES , 30700",
      "code_postal": "30700",
      "departement": "30",
      "ville": "SANILHAC SAGRIES",
      "lieu": "SANILHAC SAGRIES",
      "description": "FONDS DE COMMERCE DE BOULANGERIE PATISSERIE VIENNOISERIES SALON DE THE ET LOCATION DE VELOS SITUE 1 ROUTE DE NIMES 30700 SANILHAC-SAGRIES, ACQUIS EN AVRIL 2020 MOYENNANT LE PRIX DE 240 000 EUROS\nCA 2024 : 309 651 €\n2 SALARIES\nLOYER MENSUEL : 1 135 € + TAXE FONCIERE A REMBOURSER AU BAILLEUR (1 580,65 Euros en 2024)\nINVENTAIRE DE L'ACTIF CORPOREL EN COURS\nLOCAL DE 300 M2 EN TOTALITE AVEC SOUS LOCATION SUR 40M2 A LA SOCIETE TINKIETE (PRODUCTEUR DE LIQUEUR DE THYM) POUR 300 EUROS PAR MOIS\nSOUS LOCATION VERSEE DIRECTEMENT AU BAILLEUR - LOYER NET MENSUEL RAMENE A 835 EUROS\nDEPOT DE GARANTIE : 2 080 EUROS",
      "description_resume": "FONDS DE COMMERCE DE BOULANGERIE PATISSERIE VIENNOISERIES SALON DE THE ET LOCATION DE VELOS SITUE 1 ROUTE DE NIMES 30700 SANILHAC-SAGRIES, ACQUIS EN AVRIL 2020 MOYENNANT LE PRIX DE 240 000 EUROS",
      "activite": "FONDS DE COMMERCE DE BOULANGERIE PATISSERIE VIENNOISERIES SALON DE THE ET LOCATION DE VELOS SITUE 1 ROUTE DE NIMES 30700 SANILHAC-SAGRIES, ACQUIS EN AVRIL 2020 MOYENNANT LE PRIX DE 240 000 EUROS",
      "ca_historique": {
        "2024": "309651"
      }
    },
    {
      "url": "https://actify.fr/entreprises-liquidation-judiciaire/10910-fonds-de-commerce-de-restauration-situe-dans-un-centre-commercial-a-proximite-dun-cinema/",
      "titre": "10910 – Fonds de commerce de restauration situé dans un centre commercial, à proximité d’un cinéma.",
      "date_limite_offres": "Date limite de dépôt des offres :\n15/05/2023",
      "date_limite_offres_iso": "2023-05-15",
      "statut": "Non en activité",
      "chiffre_affaires": "De 500 001 € à 1 000 000 €",
      "ca_min_eur": 500001,
      "ca_max_eur": 1000000,
      "salaries": "Entre 6 - 10",
      "sal_min": 6,
      "sal_max": 10,
      "anciennete": "Entre 5 et 10 ans",
      "deficit_reportable": "Non",
      "code_naf": "56.10A",
      "adresse": "FENOUILLET , 31150",
      "code_postal": "31150",
      "departement": "31",
      "ville": "FENOUILLET",
      "lieu": "FENOUILLET",
      "description": "Fonds de commerce de restauration situé dans un centre commercial, à proximité d’un cinéma.\nRedressement judiciaire du 17 avril 2023.\n• Activité : Restauration traditionnelle, grill, burger, pizza, glacier, plats et boissons à emporter.\n• Lieu : FENOUILLET (Haute-Garonne)\n• Chiffre d’affaires : - au 31/12/2022 : 645 k€\n- au 31/12/2021 : 412 k€\n• Effectif total : 6 salariés\nLa date limite de dépôt des offres de reprise est fixée au 15 mai 2023 à 12 heures.\nL’accès à une data room électronique sera autorisé après régularisation d’un engagement de\nconfidentialité et une présentation succincte du candidat.\nLes candidats intéressés sont invités à se manifester auprès de :\nSELARL FHB\nMe Jean-François BLANC\nAdministrateur\nJudiciaire Associé\n22 Rue des Chasseurs -\n34070 - Montpellier - www.fhbx.eu\nTel : 04.67.42.19.20\ne-mail :\n[email protected]\nRéf : 10910",
      "description_resume": "Fonds de commerce de restauration situé dans un centre commercial, à proximité d’un cinéma.",
      "activite": "Fonds de commerce de restauration situé dans un centre commercial, à proximité d’un cinéma.",
      "ca_historique": {
        "2022": "645",
        "2021": "412"
      }
    },
    {
      "url": "https://actify.fr/entreprises-liquidation-judiciaire/10915-entreprise-de-constructions-metalliques-serrurerie-menuiserie-structure/",
      "titre": "10915 – Entreprise de constructions métalliques, serrurerie, menuiserie, structure",
      "date_limite_offres": "Date limite de dépôt des offres :\n16/10/2023",
      "date_limite_offres_iso": "2023-10-16",
      "chiffre_affaires": "De 5 000 001 € à 10 000 000 €",
      "ca_min_eur": 5000001,
      "ca_max_eur": 10000000,
      "salaries": "Entre 11 - 50",
      "sal_min": 11,
      "sal_max": 50,
      "anciennete": "Plus de 10 ans",
      "deficit_reportable": "Non",
      "code_naf": "4332B",
      "adresse": "NIMES , 30000",
      "code_postal": "30000",
      "departement": "30",
      "ville": "NIMES",
      "lieu": "NIMES",
      "description": "Redressement judiciaire du 18/04/2023\n• Activité : entreprise spécialisée dans la métallerie, la menuiserie acier et aluminium, les constructions métalliques, l’agencement dans le bâtiment et les travaux publics, intervenant au niveau national, pour une clientèle publique (80%) et privée (20%).\n• Lieu : NIMES (30)\n• Chiffre d’affaires :\n- au 31 décembre 2022 : 5,8 M€\n- au 31 décembre 2021 : 5,2 M€\n• Effectif total : 36 salariés, les fonctions administratives et financières étant assurées par le biais d’une holding, occupant 3 salariés.\nLa date limite de dépôt des offres de reprise est fixée au 7 juillet 2023 à 12 heures.\nL’accès à une data room électronique sera autorisé après régularisation d’un engagement de confidentialité et une présentation succincte du candidat.\nLes candidats intéressés sont invités à se manifester auprès de :\nSELARL FHBX\nMe Jean-François BLANC Administrateurs\nJudiciaires Associés\n22 Rue des Chasseurs -\n34070 Montpellier -\nwww.fhbx.eu\nTél : 04.67.42.19.20\ne-mails :\n[email protected]\nRéf : 10915",
      "description_resume": "Redressement judiciaire du 18/04/2023",
      "activite": "Redressement judiciaire du 18/04/2023"
    },
    {
      "url": "https://actify.fr/entreprises-liquidation-judiciaire/11094-entreprise-darmurerie-francaise/",
      "titre": "11094 – Entreprise d’armurerie française",
      "date_limite_offres": "Date limite de dépôt des offres :\n11/07/2023",
      "date_limite_offres_iso": "2023-07-11",
      "chiffre_affaires": "De 2 500 001 € à 5 000 000 €",
      "ca_min_eur": 2500001,
      "ca_max_eur": 5000000,
      "salaries": "Entre 11 - 50",
      "sal_min": 11,
      "sal_max": 50,
      "anciennete": "Entre 5 et 10 ans",
      "deficit_reportable": "Non",
      "code_naf": "4778C",
      "adresse": "Nîmes , 30000",
      "code_postal": "30000",
      "departement": "30",
      "ville": "Nîmes",
      "lieu": "Nîmes",
      "description": "Entreprise d’armurerie française.\nRedressement judiciaire du 24 mai 2023\n• Activité : Entreprise spécialisée dans l’achat, la vente notamment à distance, la réparation d’articles d’armurerie, de chasse, de tir, de pêche et de coutellerie.\n• Lieu : Gard\n• Chiffre d’affaires :\n- Au 31 décembre 2022 (annoncé) : 3,3 M€\n- Au 31 décembre 2021 : 3,6 M€\n- Au 31 décembre 2020 : 4 M€\n• Effectif total : 14 salariés.\nLa date limite de dépôt des offres de reprise est fixée au 11 juillet 2023 à 12 heures.\nL’accès à une data room électronique sera autorisé après régularisation d’un engagement de confidentialité et une présentation succincte du candidat.\nLes candidats intéressés sont invités à se manifester auprès de :\nSELARL FHB Me Jean-François BLANC Administrateurs Judiciaires Associés\n22 Rue des Chasseurs -34070 Montpellier\nwww.fhbx.eu\n04.67.42.19.20\ne-mails :\n[email protected]\nRéf : 11094",
      "description_resume": "Entreprise d’armurerie française.",
      "activite": "Entreprise d’armurerie française."
    },
    {
      "url": "https://actify.fr/entreprises-liquidation-judiciaire/112632-maison-dhabitation/",
      "titre": "112632 – Maison d’habitation",
      "date_limite_offres": "Date limite de dépôt des offres :\n21/02/2025",
      "date_limite_offres_iso": "2025-02-21",
      "chiffre_affaires": "Non renseigné",
      "salaries": "Non renseigné",
      "anciennete": "Entre 5 et 10 ans",
      "deficit_reportable": "Non",
      "adresse": "SAINT-LAURENT-LA-VALLEE , 24170",
      "code_postal": "24170",
      "departement": "24",
      "ville": "SAINT-LAURENT-LA-VALLEE",
      "lieu": "SAINT-LAURENT-LA-VALLEE",
      "description": "Maison d'habitation sis SAINT LAURENT LA VALLEE - AK N°263",
      "description_resume": "Maison d'habitation sis SAINT LAURENT LA VALLEE - AK N°263",
      "activite": "Maison d'habitation sis SAINT LAURENT LA VALLEE - AK N°263"
    },
    {
      "url": "https://actify.fr/entreprises-liquidation-judiciaire/11301_lots-de-copropriete-constitues-de-caves/",
      "titre": "11301_Lots de copropriété constitués de caves",
      "date_limite_offres": "Date limite de dépôt des offres :\n09/04/2025",
      "date_limite_offres_iso": "2025-04-09",
      "statut": "Non en activité",
      "chiffre_affaires": "Non renseigné",
      "salaries": "Non renseigné",
      "anciennete": "Plus de 10 ans",
      "deficit_reportable": "Non",
      "adresse": "136 rue Sainte Catherine\nBORDEAUX , 33000",
      "code_postal": "33000",
      "departement": "33",
      "ville": "BORDEAUX",
      "lieu": "BORDEAUX",
      "description": "Lots 102 à 112 : CAVES situées en sous-sol de l'immeuble.\nLes offres devront impérativement être adressées auprès de la SELARL EKIP', prise en la personne de Maître Christophe MANDON, 2 Rue de Caudéran 33000 BORDEAUX, impérativement avant le 09/04/2025 à 12h00.\n/! Les pièces du dossier ne seront accessibles qu'après communication par courriel de l'attestation de confidentialité dûment paraphée, attestation librement téléchargeable sur le site www.ekip.eu, onglet “cession d’actif”, référence 11301",
      "description_resume": "Lots 102 à 112 : CAVES situées en sous-sol de l'immeuble.",
      "activite": "Lots 102 à 112 : CAVES situées en sous-sol de l'immeuble."
    },
    {
      "url": "https://actify.fr/entreprises-liquidation-judiciaire/11601-recherche-repreneur-pour-une-entreprise-specialisee-dans-lindustrie-pharmaceutique/",
      "titre": "11601 – Recherche repreneur pour une entreprise spécialisée dans l'industrie pharmaceutique",
      "date_limite_offres": "Date limite de dépôt des offres :\n28/10/2023",
      "date_limite_offres_iso": "2023-10-28",
      "chiffre_affaires": "De 2 500 001 € à 5 000 000 €",
      "ca_min_eur": 2500001,
      "ca_max_eur": 5000000,
      "salaries": "Entre 11 - 50",
      "sal_min": 11,
      "sal_max": 50,
      "anciennete": "Entre 2 et 5 ans",
      "deficit_reportable": "Non",
      "adresse": "MONTPELLIER , 34000",
      "code_postal": "34000",
      "departement": "34",
      "ville": "MONTPELLIER",
      "lieu": "MONTPELLIER",
      "description": "Recherche de repreneurs pour une entreprise spécialisée dans le développement\nde logiciels et de services dans le domaine de la santé (34)\nRedressement judiciaire du 02/10/2023\nActivité : le développement de solution d’accompagnement des patients malades et de leurs\nproches par le biais d’un assistant virtuel en proposant plus de 15 applications dédiées à différentes\npathologies.\nLieu d’exploitation : Hérault (34)",
      "description_resume": "Recherche de repreneurs pour une entreprise spécialisée dans le développement",
      "activite": "Recherche de repreneurs pour une entreprise spécialisée dans le développement"
    },
    {
      "url": "https://actify.fr/entreprises-liquidation-judiciaire/11625-recherche-repreneur-pour-une-entreprise-specialisee-dans-la-fourniture-de-gaz-naturel-et-delectricite-en-france/",
      "titre": "11625 – Recherche repreneur pour une entreprise spécialisée dans la fourniture de gaz naturel et d’électricité en France.",
      "date_limite_offres": "Date limite de dépôt des offres :\n30/10/2023",
      "date_limite_offres_iso": "2023-10-30",
      "chiffre_affaires": "Plus de 10 000 000 €",
      "ca_min_eur": 10000000,
      "salaries": "Entre 11 - 50",
      "sal_min": 11,
      "sal_max": 50,
      "anciennete": "Entre 2 et 5 ans",
      "deficit_reportable": "Non",
      "adresse": "MONTPELLIER , 34000",
      "code_postal": "34000",
      "departement": "34",
      "ville": "MONTPELLIER",
      "lieu": "MONTPELLIER",
      "description": "Recherche repreneur pour une entreprise spécialisée dans la fourniture de gaz naturel et d’électricité en France.\nActivité : fourniture de gaz naturel et d’électricité sur le marché français. La société livre environ 20.000 clients sur l'ensemble du territoire desservi par Enedis et GRDF. Elle concentre principalement ses activités sur le marché résidentiel et les TPE.\nEffectif total : 18 salariés\nLa date limite de dépôt des offres de reprise est fixée au 30 octobre 2023.\nL’accès à une data room électronique sera autorisé après régularisation d’un engagement de confidentialité et une présentation succincte du candidat.\nLes candidats intéressés sont invités à se manifester auprès de SELARL FHBX, Maître Jean-François Blanc, Administrateur Judiciaire Associé, à l'adresse mail suivante:\n[email protected]\nRéférence à rappeler impérativement: 11625.",
      "description_resume": "Recherche repreneur pour une entreprise spécialisée dans la fourniture de gaz naturel et d’électricité en France.",
      "activite": "Recherche repreneur pour une entreprise spécialisée dans la fourniture de gaz naturel et d’électricité en France."
    },
    {
      "url": "https://actify.fr/entreprises-liquidation-judiciaire/11655-recherche-repreneur-pour-une-entreprise-de-negoce-de-viande/",
      "titre": "11655 – Recherche repreneur pour une entreprise de négoce de viande",
      "date_limite_offres": "Date limite de dépôt des offres :\n24/10/2023",
      "date_limite_offres_iso": "2023-10-24",
      "chiffre_affaires": "Plus de 10 000 000 €",
      "ca_min_eur": 10000000,
      "salaries": "Entre 11 - 50",
      "sal_min": 11,
      "sal_max": 50,
      "anciennete": "Plus de 10 ans",
      "deficit_reportable": "Non",
      "adresse": "NIMES , 30000",
      "code_postal": "30000",
      "departement": "30",
      "ville": "NIMES",
      "lieu": "NIMES",
      "description": "Recherche de repreneurs ou d'investisseurs pour une entreprise spécialisée dans le négoce de viande (chevillard), la fabrication et la vente de charcuteries et salaisons\nLiquidation judiciaire avec poursuite d’activité du 13 octobre 2023\n• Activité : commerce de gros de viande, fabrication et vente de charcuteries et salaisons.\n• Lieu d’exploitation : Gard (30)\n• Chiffre d’affaires : au 31/12/2022 (12 mois) : 10,9 m€\nau 31/12/2021 (12 mois) : 10,5 m€\n• Effectif total : 28 salariés\nLa date de dépôt des offres de reprise est fixée au 24 octobre 2023 à 16h00.\nL’accès à une data room électronique sera autorisé après régularisation d’un engagement de\nconfidentialité et une présentation succincte du candidat.\nLes candidats intéressés sont invités à se manifester auprès de SELARL FHBX, Maître Jean-François Blanc, Administrateur Judiciaire Associé, à l'adresse mail suivante:\n[email protected]\nRéférence à rappeler impérativement: 11655.",
      "description_resume": "Recherche de repreneurs ou d'investisseurs pour une entreprise spécialisée dans le négoce de viande (chevillard), la fabrication et la vente de charcuteries et salaisons",
      "activite": "Recherche de repreneurs ou d'investisseurs pour une entreprise spécialisée dans le négoce de viande (chevillard), la fabrication et la vente de charcuteries et salaisons"
    },
    {
      "url": "https://actify.fr/entreprises-liquidation-judiciaire/12026-recherche-repreneurs-pour-une-entreprise-specialisee-dans-le-montage-et-linstallation-de-mobiliers-evenementiels-administratifs-et-collectifs-sur-lensemble-du-bassin-mediter/",
      "titre": "12026 – Recherche repreneurs pour une entreprise spécialisée dans le montage et l’installation de mobiliers évènementiels, administratifs et collectifs sur l’ensemble du bassin méditerranéen.",
      "date_limite_offres": "Date limite de dépôt des offres :\n31/12/2025",
      "date_limite_offres_iso": "2025-12-31",
      "chiffre_affaires": "De 500 001 € à 1 000 000 €",
      "ca_min_eur": 500001,
      "ca_max_eur": 1000000,
      "salaries": "Entre 6 - 10",
      "sal_min": 6,
      "sal_max": 10,
      "anciennete": "Plus de 10 ans",
      "deficit_reportable": "Non",
      "code_naf": "43.32B",
      "adresse": "LUNEL-VIEL , 34400",
      "code_postal": "34400",
      "departement": "34",
      "ville": "LUNEL-VIEL",
      "lieu": "LUNEL-VIEL",
      "description": "Redressement judiciaire du 08 janvier 2024\n• Activité : Prestation de montages et d’installation de meubles dans le domaine de la PLV/ILV, au sein des collectivités, pour le compte de professionnels, dans le secteur administratif.\n• Lieu : Hérault\n• Chiffre d’affaires :\n- au 31/12/2023 : 979.788 €\n- au 31/12/2022 : 993.988 €\n• Effectif total : 10 salariés\nLa date limite de dépôt des offres de reprise est en cours de fixation.\nL’accès à une data room électronique sera autorisé après régularisation d’un engagement de\nconfidentialité et une présentation succincte du candidat.\nLes candidats intéressés sont invités à se manifester auprès de :\nSELARL FHBX\nMe Jean-François BLANC\nAdministrateurs\nJudiciaires Associés\n22 Rue des Chasseurs -\n34070 MONTPELLIER\ne-mails :\n[email protected]",
      "description_resume": "Redressement judiciaire du 08 janvier 2024",
      "activite": "Redressement judiciaire du 08 janvier 2024",
      "ca_historique": {
        "2023": "979.788",
        "2022": "993.988"
      }
    },
    {
      "url": "https://actify.fr/entreprises-liquidation-judiciaire/12921-acteur-proposant-une-solution-saas-software-as-a-service-permettant-de-mesurer-danalyser-et-damplifier-les-retombees-digitales-des-publicites-tv/",
      "titre": "12921 – Acteur proposant une solution SAAS (Software As A Service) permettant de mesurer, d’analyser et d’amplifier les retombées digitales des publicités TV",
      "date_limite_offres": "Date limite de dépôt des offres :\n31/07/2024",
      "date_limite_offres_iso": "2024-07-31",
      "statut": "Non en activité",
      "chiffre_affaires": "De 1 000 001 € à 2 500 000 €",
      "ca_min_eur": 1000001,
      "ca_max_eur": 2500000,
      "salaries": "Entre 11 - 50",
      "sal_min": 11,
      "sal_max": 50,
      "anciennete": "Plus de 10 ans",
      "deficit_reportable": "Non",
      "adresse": "Paris , 75000",
      "code_postal": "75000",
      "departement": "75",
      "ville": "Paris",
      "lieu": "Paris",
      "description": "Acteur proposant une solution SAAS (Software As A Service) permettant de mesurer, d’analyser et d’amplifier les retombées digitales des publicités TV\n• Trois offres complémentaires : analyse des investissements des annonceurs en matière de publicité TV ; mesure de l’impact de la publicité sur l’environnement en ligne de l’annonceur ; solutions de conversion de l’audience TV en audience digitale / Technologie brevetée\n• Clientèle de premier plan : agences média et plus de 100 marques à travers l’Europe regroupant une quinzaine de secteurs d’activité\n• Chiffre d’affaires au 31/12/2023 : 2 035 K€\n• Lieu : Paris (75)\n• Effectif total : 21 salariés\n• Recherche initiée dans le cadre d’une procédure de conciliation avec possibilité de mise en œuvre dans un cadre judiciaire\nLa date limite de dépôt des offres de reprise est fixée au\n31 juillet 2024 à 12h00.\nL’accès à une data room électronique sera autorisé après régularisation d’un engagement de\nconfidentialité et une présentation succincte du candidat.\nLes candidats intéressés sont invités à se manifester auprès de :\nSELARL FHBX - Me Gaël Couturier, Administrateur judiciaire associé\n176 Avenue Charles de Gaulle 92200 Neuilly-sur-Seine www.fhbx.eu\ne-mails :\n[email protected]\n[email protected]",
      "description_resume": "Acteur proposant une solution SAAS (Software As A Service) permettant de mesurer, d’analyser et d’amplifier les retombées digitales des publicités TV",
      "activite": "Acteur proposant une solution SAAS (Software As A Service) permettant de mesurer, d’analyser et d’amplifier les retombées digitales des publicités TV",
      "ca_historique": {
        "2023": "2035"
      }
    },
    {
      "url": "https://actify.fr/entreprises-liquidation-judiciaire/1294/",
      "titre": "1294",
      "date_limite_offres": "Date limite de dépôt des offres :\n15/04/2024",
      "date_limite_offres_iso": "2024-04-15",
      "chiffre_affaires": "De 5 000 001 € à 10 000 000 €",
      "ca_min_eur": 5000001,
      "ca_max_eur": 10000000,
      "salaries": "Plus de 100",
      "sal_min": 100,
      "anciennete": "Non renseignée",
      "deficit_reportable": "Non",
      "adresse": "119 Rue Jacquemars Giélée\nLILLE , 59041",
      "code_postal": "59041",
      "departement": "59",
      "ville": "LILLE",
      "lieu": "LILLE",
      "description": "Sociétés : HAUT DE CHAUSS & CHAUSSURES DELOUX\nActivité :\n• HAUT DE CHAUSS : Exploitation de magasins de chaussures sous enseigne « MILLIM », « CHAUSS’MOMES » et « NINFEA »,\n• CHAUSSURES DELOUX : Exploitation de magasins de chaussures sous enseigne « MILLIM »,\nOrganisation :\n• HAUT DE CHAUSS : 30 magasins principalement situés dans le Nord et l’Ouest de la FRANCE\n• CHAUSSURES DELOUX : 2 magasins situés dans la Métropole Lilloise\nEffectif :\n• HAUT DE CHAUSS : 121 salariés\n• CHAUSSURES DELOUX : 6 salariés\nK€ HAUT DE CHAUSS CHAUSSURES DELOUX\nExercice concerné 2020 2021 2022 2020 2021 2022\nDurée 15 mois 12 mois 12 mois 21 mois 15 mois 12 mois\nCA HT 15 571 11 625 13 344 2 605 1 659 1 552\nREX 267 (334) (1 396) (380) (10) (154)\nR.NET 302 54 (1 308) (162) (19) (151)\nDate limite de dépôt des offres : 15 avril 2024 à 12h00",
      "description_resume": "Sociétés : HAUT DE CHAUSS & CHAUSSURES DELOUX",
      "activite": "Sociétés : HAUT DE CHAUSS & CHAUSSURES DELOUX"
    },
    {
      "url": "https://actify.fr/entreprises-liquidation-judiciaire/134718-batiment/",
      "titre": "134718 – Bâtiment",
      "date_limite_offres": "Date limite de dépôt des offres :\n14/03/2025",
      "date_limite_offres_iso": "2025-03-14",
      "chiffre_affaires": "Non renseigné",
      "salaries": "Non renseigné",
      "anciennete": "Entre 2 et 5 ans",
      "deficit_reportable": "Non",
      "adresse": "ROQUES\nPUISSEGUIN , 33570",
      "code_postal": "33570",
      "departement": "33",
      "ville": "PUISSEGUIN",
      "lieu": "PUISSEGUIN"
    },
    {
      "url": "https://actify.fr/entreprises-liquidation-judiciaire/14035-recherche-repreneur-pour-une-entreprise-de-conception-developpement-commercialisation-de-produits-et-services-innovants-dans-le-digital/",
      "titre": "14035 – Recherche repreneur pour une entreprise de conception, développement, commercialisation de produits et services innovants dans le digital.",
      "date_limite_offres": "Date limite de dépôt des offres :\n17/03/2025",
      "date_limite_offres_iso": "2025-03-17",
      "chiffre_affaires": "De 0 € à 250 000 €",
      "ca_min_eur": 0,
      "ca_max_eur": 250000,
      "salaries": "Entre 0 et 5",
      "sal_min": 0,
      "sal_max": 5,
      "anciennete": "Entre 5 et 10 ans",
      "deficit_reportable": "Non",
      "adresse": "MONTPELLIER , 34000",
      "code_postal": "34000",
      "departement": "34",
      "ville": "MONTPELLIER",
      "lieu": "MONTPELLIER",
      "description": "Recherche repreneur pour une entreprise de conception, développement, commercialisation de produits et services innovants dans le digital.\nRedressement judiciaire du 14/10/2024\n• Activités :\n- recherche, développement et commercialisation d’un dispositif de téléassistance next-gen doté d’une intelligence conversationnelle,\n- agence de développement de produits digitaux (IA et application web et mobile)\n• Lieu : Hérault\n• Chiffre d’affaires :\n- au 31/10/2024 : 320 k€\n- au 31/12/2023 : 143 K€\n- au 31/12/2022 : 55 K€\nEffectif total : 4 salariés\nLa date limite de dépôt des offres de reprise est fixée au 17 mars 2025 à 12h00.\nL’accès à une data room électronique sera autorisé après régularisation d’un engagement de confidentialité et une présentation succincte du candidat.\nLes candidats intéressés sont invités à se manifester auprès de :\nSELARL FHBX\nMe Jean-François BLANC\n22 Rue des Chasseurs -\n34070 MONTPELLIER\nMontpellier - www.fhbx.eu\ne-mails :\n[email protected]\nRéférence : 14035",
      "description_resume": "Recherche repreneur pour une entreprise de conception, développement, commercialisation de produits et services innovants dans le digital.",
      "activite": "Recherche repreneur pour une entreprise de conception, développement, commercialisation de produits et services innovants dans le digital.",
      "ca_historique": {
        "2024": "320",
        "2023": "143",
        "2022": "55"
      }
    },
    {
      "url": "https://actify.fr/entreprises-liquidation-judiciaire/1406-appel-doffres-de-reprise-de-lentreprise-activite-de-vente-et-la-location-de-materiel-medical/",
      "titre": "1406 | Appel d'offres de reprise de l'entreprise : Activité de vente et la location de matériel médical",
      "date_limite_offres": "Date limite de dépôt des offres :\n03/03/2023",
      "date_limite_offres_iso": "2023-03-03",
      "chiffre_affaires": "De 2 500 001 € à 5 000 000 €",
      "ca_min_eur": 2500001,
      "ca_max_eur": 5000000,
      "salaries": "Entre 11 - 50",
      "sal_min": 11,
      "sal_max": 50,
      "anciennete": "Plus de 10 ans",
      "deficit_reportable": "Non",
      "adresse": "FORT DE FRANCE , 97200",
      "code_postal": "97200",
      "departement": "97",
      "ville": "FORT DE FRANCE",
      "lieu": "FORT DE FRANCE",
      "description": "Activité de vente et la location de matériel médical",
      "description_resume": "Activité de vente et la location de matériel médical",
      "activite": "Activité de vente et la location de matériel médical"
    },
    {
      "url": "https://actify.fr/entreprises-liquidation-judiciaire/1407-appel-doffres-de-reprise-de-lentreprise-activite-de-vente-et-la-location-de-materiel-medical/",
      "titre": "1407 | Appel d'offres de reprise de l'entreprise : Activité de vente et la location de matériel médical",
      "date_limite_offres": "Date limite de dépôt des offres :\n03/03/2023",
      "date_limite_offres_iso": "2023-03-03",
      "chiffre_affaires": "De 2 500 001 € à 5 000 000 €",
      "ca_min_eur": 2500001,
      "ca_max_eur": 5000000,
      "salaries": "Entre 11 - 50",
      "sal_min": 11,
      "sal_max": 50,
      "anciennete": "Plus de 10 ans",
      "deficit_reportable": "Non",
      "adresse": "FORT DE FRANCE , 97200",
      "code_postal": "97200",
      "departement": "97",
      "ville": "FORT DE FRANCE",
      "lieu": "FORT DE FRANCE",
      "description": "Activité de vente et la location de matériel médical",
      "description_resume": "Activité de vente et la location de matériel médical",
      "activite": "Activité de vente et la location de matériel médical"
    },
    {
      "url": "https://actify.fr/entreprises-liquidation-judiciaire/1408-appel-doffres-de-reprise-dentreprise-activites-de-holding-pour-un-groupe-specialise-dans-la-vente-et-la-location-de-materiel-medical/",
      "titre": "1408 | Appel d'offres de reprise d'entreprise : Activités de holding pour un groupe spécialisé  dans la vente et la location de matériel médical",
      "date_limite_offres": "Date limite de dépôt des offres :\n03/03/2023",
      "date_limite_offres_iso": "2023-03-03",
      "chiffre_affaires": "De 500 001 € à 1 000 000 €",
      "ca_min_eur": 500001,
      "ca_max_eur": 1000000,
      "salaries": "Entre 6 - 10",
      "sal_min": 6,
      "sal_max": 10,
      "anciennete": "Plus de 10 ans",
      "deficit_reportable": "Non",
      "adresse": "FORT DE FRANCE , 97200",
      "code_postal": "97200",
      "departement": "97",
      "ville": "FORT DE FRANCE",
      "lieu": "FORT DE FRANCE",
      "description": "Activités de holding pour un groupe spécialisé dans la vente et la location de matériel médical",
      "description_resume": "Activités de holding pour un groupe spécialisé dans la vente et la location de matériel médical",
      "activite": "Activités de holding pour un groupe spécialisé dans la vente et la location de matériel médical"
    },
    {
      "url": "https://actify.fr/entreprises-liquidation-judiciaire/1458-boulangerie-06/",
      "titre": "1458 – BOULANGERIE  (06)",
      "date_limite_offres": "Date limite de dépôt des offres :\n04/08/2023",
      "date_limite_offres_iso": "2023-08-04",
      "statut": "Non en activité",
      "chiffre_affaires": "De 0 € à 250 000 €",
      "ca_min_eur": 0,
      "ca_max_eur": 250000,
      "salaries": "Entre 0 et 5",
      "sal_min": 0,
      "sal_max": 5,
      "anciennete": "Entre 2 et 5 ans",
      "deficit_reportable": "Non",
      "adresse": "saint laurent du var , 06700",
      "code_postal": "06700",
      "departement": "06",
      "ville": "saint laurent du var",
      "lieu": "saint laurent du var",
      "description": "Administrateur Judiciaire recherche acquéreur pour une boulangerie à Saint-Laurent-du-Var (Alpes-Maritimes)",
      "description_resume": "Administrateur Judiciaire recherche acquéreur pour une boulangerie à Saint-Laurent-du-Var (Alpes-Maritimes)",
      "activite": "Administrateur Judiciaire recherche acquéreur pour une boulangerie à Saint-Laurent-du-Var (Alpes-Maritimes)",
      "ca_historique": {
        "2022": "152"
      }
    },
    {
      "url": "https://actify.fr/entreprises-liquidation-judiciaire/15236-brevet/",
      "titre": "15236 – BREVET",
      "date_limite_offres": "Date limite de dépôt des offres :\n30/12/2025",
      "date_limite_offres_iso": "2025-12-30",
      "chiffre_affaires": "Non renseigné",
      "salaries": "Non renseigné",
      "anciennete": "Entre 0 et 2 ans",
      "deficit_reportable": "Non",
      "adresse": "PALAISEAU , 91120",
      "code_postal": "91120",
      "departement": "91",
      "ville": "PALAISEAU",
      "lieu": "PALAISEAU",
      "description": "BREVET AU NIVEAU NATIONEL INPI n° 19\nBrevet protégeant une invention de bride avec boucles pour souliers pouvant être interchangée.\nLa technique protégée met notamment en oeuvre un dispositif d'assemblage amovible entre 2 pièces, composé de 2 parties, formant un couple mâle-femelle, configurées pour adopter 2 positions verrouillée et déverrouillées.",
      "description_resume": "BREVET AU NIVEAU NATIONEL INPI n° 19",
      "activite": "BREVET AU NIVEAU NATIONEL INPI n° 19"
    },
    {
      "url": "https://actify.fr/entreprises-liquidation-judiciaire/15902-elements-actifs-corporels-et-incorporels/",
      "titre": "15902 – ELEMENTS ACTIFS CORPORELS ET INCORPORELS",
      "date_limite_offres": "Date limite de dépôt des offres :\n21/01/2026",
      "date_limite_offres_iso": "2026-01-21",
      "statut": "Non en activité",
      "chiffre_affaires": "Non renseigné",
      "salaries": "Non renseigné",
      "anciennete": "Entre 0 et 2 ans",
      "deficit_reportable": "Non",
      "adresse": "EVRY , 91000",
      "code_postal": "91000",
      "departement": "91",
      "ville": "EVRY",
      "lieu": "EVRY",
      "description": "FDC composé des éléments suivants :\n- l’enseigne, le nom commercial, la clientèle, et l’achalandage y attachés,\n- les droits au bail des locaux,\n- mobilier et matériel d'exploitation,\n- portefeuille de brevets,\n- marques et noms de domaine.\nMerci de vous rapprocher de l'étude pour avoir vos accès à la dataroom.",
      "description_resume": "FDC composé des éléments suivants :",
      "activite": "FDC composé des éléments suivants :"
    },
    {
      "url": "https://actify.fr/entreprises-liquidation-judiciaire/15933-fdc-negoce-de-produits-et-materiels-pour-liquides-indust-2/",
      "titre": "15933 – FDC NEGOCE DE PRODUITS ET MATERIELS POUR LIQUIDES INDUST",
      "date_limite_offres": "Date limite de dépôt des offres :\n28/11/2025",
      "date_limite_offres_iso": "2025-11-28",
      "statut": "Non en activité",
      "chiffre_affaires": "Non renseigné",
      "salaries": "Non renseigné",
      "anciennete": "Entre 0 et 2 ans",
      "deficit_reportable": "Non",
      "adresse": "EGLY , 91520",
      "code_postal": "91520",
      "departement": "91",
      "ville": "EGLY",
      "lieu": "EGLY",
      "description": "FDC négoce de produits et matériels pour liquides industriels et alimentaires",
      "description_resume": "FDC négoce de produits et matériels pour liquides industriels et alimentaires",
      "activite": "FDC négoce de produits et matériels pour liquides industriels et alimentaires"
    },
    {
      "url": "https://actify.fr/entreprises-liquidation-judiciaire/15933-fdc-negoce-de-produits-et-materiels-pour-liquides-indust-3/",
      "titre": "15933 – FDC NEGOCE DE PRODUITS ET MATERIELS POUR LIQUIDES INDUST",
      "date_limite_offres": "Date limite de dépôt des offres :\n28/11/2025",
      "date_limite_offres_iso": "2025-11-28",
      "statut": "Non en activité",
      "chiffre_affaires": "Non renseigné",
      "salaries": "Non renseigné",
      "anciennete": "Entre 0 et 2 ans",
      "deficit_reportable": "Non",
      "adresse": "EAUZE , 32800",
      "code_postal": "32800",
      "departement": "32",
      "ville": "EAUZE",
      "lieu": "EAUZE",
      "description": "FDC négoce de produits et matériels pour liquides industriels et alimentaires",
      "description_resume": "FDC négoce de produits et matériels pour liquides industriels et alimentaires",
      "activite": "FDC négoce de produits et matériels pour liquides industriels et alimentaires"
    },
    {
      "url": "https://actify.fr/entreprises-liquidation-judiciaire/15933-fdc-negoce-de-produits-et-materiels-pour-liquides-indust/",
      "titre": "15933 – FDC NEGOCE DE PRODUITS ET MATERIELS POUR LIQUIDES INDUST",
      "date_limite_offres": "Date limite de dépôt des offres :\n28/11/2025",
      "date_limite_offres_iso": "2025-11-28",
      "statut": "Non en activité",
      "chiffre_affaires": "Non renseigné",
      "salaries": "Non renseigné",
      "anciennete": "Entre 0 et 2 ans",
      "deficit_reportable": "Non",
      "adresse": "CHATEAUBERNARD , 16100",
      "code_postal": "16100",
      "departement": "16",
      "ville": "CHATEAUBERNARD",
      "lieu": "CHATEAUBERNARD",
      "description": "FDC négoce de produits et matériels pour liquides industriels et alimentaires",
      "description_resume": "FDC négoce de produits et matériels pour liquides industriels et alimentaires",
      "activite": "FDC négoce de produits et matériels pour liquides industriels et alimentaires"
    },
    {
      "url": "https://actify.fr/entreprises-liquidation-judiciaire/15933-negoce-de-produits-et-materiels-pour-liquides-industriel/",
      "titre": "15933 – NEGOCE DE PRODUITS ET MATERIELS POUR LIQUIDES INDUSTRIEL",
      "date_limite_offres": "Date limite de dépôt des offres :\n28/11/2025",
      "date_limite_offres_iso": "2025-11-28",
      "statut": "Non en activité",
      "chiffre_affaires": "Non renseigné",
      "salaries": "Non renseigné",
      "anciennete": "Entre 0 et 2 ans",
      "deficit_reportable": "Non",
      "adresse": "MONCLAR , 32150",
      "code_postal": "32150",
      "departement": "32",
      "ville": "MONCLAR",
      "lieu": "MONCLAR",
      "description": "FDC négoce de produits et matériels pour liquides industriels et alimentaires",
      "description_resume": "FDC négoce de produits et matériels pour liquides industriels et alimentaires",
      "activite": "FDC négoce de produits et matériels pour liquides industriels et alimentaires"
    },
    {
      "url": "https://actify.fr/entreprises-liquidation-judiciaire/15986-fdc-restaurant/",
      "titre": "15986 – FDC RESTAURANT",
      "date_limite_offres": "Date limite de dépôt des offres :\n19/12/2024",
      "date_limite_offres_iso": "2024-12-19",
      "statut": "Non en activité",
      "chiffre_affaires": "Non renseigné",
      "salaries": "Non renseigné",
      "anciennete": "Entre 0 et 2 ans",
      "deficit_reportable": "Non",
      "adresse": "SOISY-SUR-SEINE , 91450",
      "code_postal": "91450",
      "departement": "91",
      "ville": "SOISY-SUR-SEINE",
      "lieu": "SOISY-SUR-SEINE",
      "description": "Local à usage commercial comprenant :\nAu rez de chaussée: Un hall d'accueil, une salle, un salon, des toilettes hommes et femmes avec\nlave-mains, une cuisine,\nAu rez-de-jardin : une salle\nUn étage quatre pièces, une salle de bains, un wc,\nUn grenier,\nDeux caves en sous sol,\nUne cour et un jardin paysagé,\nUne terrasse entourée de murets,\nLe tout pour une surface total de 160 m² sur un terrain de 690 m²\nLicence IV\nActifs mobiliers",
      "description_resume": "Local à usage commercial comprenant :",
      "surface_m2": "160",
      "activite": "Local à usage commercial comprenant :"
    },
    {
      "url": "https://actify.fr/entreprises-liquidation-judiciaire/16082-elements-incorporels/",
      "titre": "16082 – ELEMENTS INCORPORELS",
      "date_limite_offres": "Date limite de dépôt des offres :\n20/02/2025",
      "date_limite_offres_iso": "2025-02-20",
      "statut": "Non en activité",
      "chiffre_affaires": "Non renseigné",
      "salaries": "Non renseigné",
      "anciennete": "Entre 0 et 2 ans",
      "deficit_reportable": "Non",
      "adresse": "EVRY , 91000",
      "code_postal": "91000",
      "departement": "91",
      "ville": "EVRY",
      "lieu": "EVRY",
      "description": "- l’enseigne, le nom commercial, la clientèle, et l’achalandage y attachés\n- le MOBILIER et MATERIEL, LE STOCK d’exploitation\n- les BREVETS\nUSLX-001 Peptidic Scafold\nUSLX-001-EP EP 21724701.4\nUSLX-001-US US 17/925,543\nUSLX-001-CN CN 202180049749.3\nUSLX-001-KR KR 10-2022-7043884\nUSLX-002 Archeal DNA primase\nUSLX-002-EP EP 21732048.0\nUSLX-002-US US 18/009,673\nUSLX-002-CN CN 202180056165.9\nUSLX-002-KR KR 10-2023-7001250\nUSLX-003 AB initio synthesis\nUSLX-003-EP EP 21731191.9\nUSLX-003-US US 18/009,667\nUSLX-003-CN CN 202180055846.3\nUSLX-003-KR KR 10-2023-7001251\nUSLX-004 Thermocycled multistep reaction\nUSLX-004-EP EP 22839664.4\nUSLX-004-US US 18/744,396\nUSLX-006 Thermocycled multistep reaction\nUSLX-006-EP EP 22839664.4\nUSLX-006-US US 18/744,396\nUSLX-007 DNA reactor\nUSLX-007-EP EP 22839664.4\nUSLX-007-US US 18/744,396\nUSLX-008 VARIANTS OF THERMOSTABLE DNA PRIMASES AND USES THEREOF\nUSLX-008-EP EP 22839664.4\nUSLX-008-US US 18/744,396\nUSLX-009 Method for adhering a poly(dA/dT) tail to a DNA backbone\nUSLX-010 Universal Landing Plateform\nUSLX-010-PRIO EP 24306350.0\nUSLX-013 DNA amplification\nUSLX-013-PCT PCT/EP2024/060060",
      "description_resume": "- l’enseigne, le nom commercial, la clientèle, et l’achalandage y attachés",
      "activite": "- l’enseigne, le nom commercial, la clientèle, et l’achalandage y attachés"
    },
    {
      "url": "https://actify.fr/entreprises-liquidation-judiciaire/16350-actifs-corporels-et-incorporels/",
      "titre": "16350 – ACTIFS CORPORELS et INCORPORELS",
      "date_limite_offres": "Date limite de dépôt des offres :\n31/10/2025",
      "date_limite_offres_iso": "2025-10-31",
      "chiffre_affaires": "Non renseigné",
      "salaries": "Non renseigné",
      "anciennete": "Entre 0 et 2 ans",
      "deficit_reportable": "Non",
      "adresse": "BRETIGNY-SUR-ORGE , 91220",
      "code_postal": "91220",
      "departement": "91",
      "ville": "BRETIGNY-SUR-ORGE",
      "lieu": "BRETIGNY-SUR-ORGE",
      "description": " Actifs incorporels\n Le mobilier et le matériel d’exploitation\n L’enseigne, le nom commercial, la clientèle, et l’achalandage y attachés,\n Le droit au bail des locaux",
      "description_resume": " Actifs incorporels",
      "activite": " Actifs incorporels"
    },
    {
      "url": "https://actify.fr/entreprises-liquidation-judiciaire/16610-elements-dactifs/",
      "titre": "16610 – ÉLÉMENTS D’ACTIFS",
      "date_limite_offres": "Date limite de dépôt des offres :\n30/09/2025",
      "date_limite_offres_iso": "2025-09-30",
      "statut": "Non en activité",
      "chiffre_affaires": "Non renseigné",
      "salaries": "Non renseigné",
      "anciennete": "Entre 0 et 2 ans",
      "deficit_reportable": "Non",
      "adresse": "ORSAY , 91400",
      "code_postal": "91400",
      "departement": "91",
      "ville": "ORSAY",
      "lieu": "ORSAY",
      "description": "1- Actifs corporels :\n• Baie 42U noire acier à portes verre et roulettes, ventilée, switch, hauteur ~2m, 2021 : 1\n• Serveur rack PC 19 pouces proc AMD 7543P, 128 GB RAM, 2021 : 1\n• Serveur rack PC 19 pouces proc Intel Xeon 6312, 64 GB RAM, 2021 : 1\n• Serveurs rack PC 19 pouces proc Intel Core i9, 10980, 16 GB RAM, 2021 : 2\n• Ordinateurs bureautiques PC format tour avec pour certains des cartes graphiques, et écrans 21 pouces, de 2014 à 2019 : 12\nL'inventaire du commissaire de justice est en cours d'établissement.\n2- Actifs incorporels :\n• Marque « EVITECH » déposée à l’INPI\n• Noms de domaines URLs www.e-vitech.com, evitech.com, e-vitech.fr, evitech.fr, ...\n• Site web et outil de configuration « evdesign.com »\n• Logo EVITECH\n• Base de centaines de contacts commerciaux validés à jour sous l’outil Mailchimp\n• Base de données du logiciel ERP iTOP de la société (contrats, factures, contacts)\n• Logiciels utilitaires Mantis (suivi des DFT), ZULIP (chat « maison »), Jenkins (Automatisation des tests), Mercurial (versions), et composants logiciels produits maison Jaguar et Lynx dont les licences d’emploi sont vendues par EVITECH.",
      "description_resume": "1- Actifs corporels :",
      "activite": "1- Actifs corporels :"
    },
    {
      "url": "https://actify.fr/entreprises-liquidation-judiciaire/1669-appel-doffres-restaurant-le-district/",
      "titre": "1669 – APPEL D’OFFRES – RESTAURANT “LE DISTRICT”",
      "date_limite_offres": "Date limite de dépôt des offres :\n12/12/2025",
      "date_limite_offres_iso": "2025-12-12",
      "chiffre_affaires": "Non renseigné",
      "salaries": "Entre 0 et 5",
      "sal_min": 0,
      "sal_max": 5,
      "anciennete": "Entre 0 et 2 ans",
      "deficit_reportable": "Non",
      "adresse": "80 Rue Montmartre\nPARIS-2E-ARRONDISSEMENT , 75002",
      "code_postal": "75002",
      "departement": "75",
      "ville": "E-ARRONDISSEMENT",
      "lieu": "E-ARRONDISSEMENT",
      "description": "Activité : Bar / Restauration sur place (avec extraction).\nCuisine de bistrot contemporaine.",
      "description_resume": "Activité : Bar / Restauration sur place (avec extraction).",
      "activite": "Activité : Bar / Restauration sur place (avec extraction).",
      "ca_historique": {
        "2024": "402",
        "2023": "522",
        "2022": "614"
      }
    },
    {
      "url": "https://actify.fr/entreprises-liquidation-judiciaire/16699-elements-dactis-corporels-et-incorporels/",
      "titre": "16699 – ELEMENTS D’ACTIS CORPORELS ET INCORPORELS",
      "date_limite_offres": "Date limite de dépôt des offres :\n22/01/2026",
      "date_limite_offres_iso": "2026-01-22",
      "statut": "Non en activité",
      "chiffre_affaires": "Non renseigné",
      "salaries": "Non renseigné",
      "anciennete": "Entre 0 et 2 ans",
      "deficit_reportable": "Non",
      "adresse": "EVRY , 91000",
      "code_postal": "91000",
      "departement": "91",
      "ville": "EVRY",
      "lieu": "EVRY",
      "description": "Brevets, marques et nom de domaine,\nActifs mobiliers.\nDroit au bail des locaux d'Evry et de Paris.",
      "description_resume": "Brevets, marques et nom de domaine,",
      "activite": "Brevets, marques et nom de domaine,"
    },
    {
      "url": "https://actify.fr/entreprises-liquidation-judiciaire/169-rue-du-marechal-leclerc/",
      "titre": "169 rue du Maréchal Leclerc",
      "date_limite_offres": "Date limite de dépôt des offres :\n30/10/2025",
      "date_limite_offres_iso": "2025-10-30",
      "chiffre_affaires": "Non renseigné",
      "salaries": "Non renseigné",
      "anciennete": "Entre 2 et 5 ans",
      "deficit_reportable": "Non",
      "adresse": "169 rue du Maréchal Leclerc\nPINEUILH , 33220",
      "code_postal": "33220",
      "departement": "33",
      "ville": "PINEUILH",
      "lieu": "PINEUILH",
      "description": "Maison d'habitation avec jardin\nRéférence cadastrale : AM 15",
      "description_resume": "Maison d'habitation avec jardin",
      "activite": "Maison d'habitation avec jardin"
    },
    {
      "url": "https://actify.fr/entreprises-liquidation-judiciaire/1691-locaux-professionnels-donnes-a-bail/",
      "titre": "1691 – locaux professionnels donnés à bail",
      "date_limite_offres": "Date limite de dépôt des offres :\n28/07/2025",
      "date_limite_offres_iso": "2025-07-28",
      "chiffre_affaires": "De 0 € à 250 000 €",
      "ca_min_eur": 0,
      "ca_max_eur": 250000,
      "salaries": "Entre 0 et 5",
      "sal_min": 0,
      "sal_max": 5,
      "anciennete": "Plus de 10 ans",
      "deficit_reportable": "Non",
      "adresse": "la garde , 83210",
      "code_postal": "83210",
      "departement": "83",
      "ville": "la garde",
      "lieu": "la garde",
      "description": "Administrateur Judiciaire recherche acquéreur pour une entreprise\nen Redressement judiciaire détenant des locaux professionnels donnés à bail à 3 locataires exploitant un bowling, une salle de sport et une salle de trampoline, outre des parkings adjacents sur la commune de LA GARDE\nSurface Globale terrain + locaux : 84 a et 35 ca\nMontant loyers mensuel HT : 50 K€ environ (difficultés d’encaissement de certains loyers)\nDate limite de dépôt des offres : 06/01/2025 à 12 heures reportée au 28/07/2025 à 12 heures",
      "description_resume": "Administrateur Judiciaire recherche acquéreur pour une entreprise",
      "activite": "Administrateur Judiciaire recherche acquéreur pour une entreprise"
    },
    {
      "url": "https://actify.fr/entreprises-liquidation-judiciaire/1725-entreprise-de-transport-routier-de-marchandises/",
      "titre": "1725 – entreprise de transport routier de marchandises",
      "date_limite_offres": "Date limite de dépôt des offres :\n01/07/2025",
      "date_limite_offres_iso": "2025-07-01",
      "statut": "Non en activité",
      "chiffre_affaires": "Plus de 10 000 000 €",
      "ca_min_eur": 10000000,
      "salaries": "Entre 51 - 100",
      "sal_min": 51,
      "sal_max": 100,
      "anciennete": "Plus de 10 ans",
      "deficit_reportable": "Non",
      "adresse": "Brignoles , 83170",
      "code_postal": "83170",
      "departement": "83",
      "ville": "Brignoles",
      "lieu": "Brignoles",
      "description": "Administrateur Judiciaire recherche acquéreur pour une entreprise de\nTransport routier de marchandise",
      "description_resume": "Administrateur Judiciaire recherche acquéreur pour une entreprise de",
      "activite": "Administrateur Judiciaire recherche acquéreur pour une entreprise de"
    },
    {
      "url": "https://actify.fr/entreprises-liquidation-judiciaire/1727/",
      "titre": "1727",
      "date_limite_offres": "Date limite de dépôt des offres :\n31/10/2025",
      "date_limite_offres_iso": "2025-10-31",
      "chiffre_affaires": "De 1 000 001 € à 2 500 000 €",
      "ca_min_eur": 1000001,
      "ca_max_eur": 2500000,
      "salaries": "Entre 6 - 10",
      "sal_min": 6,
      "sal_max": 10,
      "anciennete": "Non renseignée",
      "deficit_reportable": "Non",
      "adresse": "119 Rue Jacquemars Giélée\nLILLE , 59041",
      "code_postal": "59041",
      "departement": "59",
      "ville": "LILLE",
      "lieu": "LILLE",
      "description": "Activité : Prestations de services IT en régie et direct\nDate de création : 2014\nCA HT 31/03/2024 (12 mois) : 1 855 217 €\nCA HT 31/03/2025 (12 mois) : 1 431 838 €",
      "description_resume": "Activité : Prestations de services IT en régie et direct",
      "activite": "Activité : Prestations de services IT en régie et direct"
    },
    {
      "url": "https://actify.fr/entreprises-liquidation-judiciaire/1769/",
      "titre": "1769",
      "date_limite_offres": "Date limite de dépôt des offres :\n17/04/2025",
      "date_limite_offres_iso": "2025-04-17",
      "chiffre_affaires": "De 500 001 € à 1 000 000 €",
      "ca_min_eur": 500001,
      "ca_max_eur": 1000000,
      "salaries": "Entre 0 et 5",
      "sal_min": 0,
      "sal_max": 5,
      "anciennete": "Non renseignée",
      "deficit_reportable": "Non",
      "adresse": "119 Rue Jacquemars Giélée\nLILLE , 59041",
      "code_postal": "59041",
      "departement": "59",
      "ville": "LILLE",
      "lieu": "LILLE",
      "description": "Activité : PHARMACIE\nCA HT 30/09/2023 (12 mois) : 438 891 €\nCA HT 30/09/2022 (12 mois) : 554 419 €",
      "description_resume": "Activité : PHARMACIE",
      "activite": "Activité : PHARMACIE"
    },
    {
      "url": "https://actify.fr/entreprises-liquidation-judiciaire/1771-entreprise-en-redressement-judiciaire-creant-des-solutions-operationnelles-et-numeriques-pour-lamelioration-de-la-responsabilite-societale-des-entreprises-du-commerce-rse/",
